,number,value,datetime_start,datetime_complete,duration,params_activation_fn,params_clip_obs,params_ent_coef,params_gae_lambda,params_gamma,params_initialization_strategy,params_learning_rate,params_lr_schedule,params_max_grad_norm,params_max_ingredients,params_n_steps,params_net_arch_depth,params_net_arch_width,params_norm_reward,params_normalize_advantage,params_ortho_init,params_rms_prop_eps,params_sde_sample_freq,params_use_rms_prop,params_use_sde,params_vf_coef,state
225,225,265.9533814,2024-07-02 02:27:00.308770,2024-07-02 02:45:59.630241,0 days 00:18:59.321471,tanh,50.0,0.020759197900346773,0.9,0.9464954242071455,,0.006706002404550159,constant,0.5,8,20.0,2.0,128.0,False,False,False,8.928243582346033e-05,92.0,True,True,0.3311319826344935,COMPLETE
226,226,7.4,2024-07-02 02:34:49.158734,2024-07-02 02:48:20.413779,0 days 00:13:31.255045,tanh,100.0,2.177804247685381e-05,0.98,0.9896392539722592,,0.0638861913200637,constant,0.9,6,50.0,1.0,128.0,False,True,False,0.0003226925193555633,10.0,False,False,0.9377051641962,COMPLETE
227,227,69.209721,2024-07-02 02:40:37.281902,2024-07-02 02:57:00.110908,0 days 00:16:22.829006,elu,50.0,0.016919443335558667,0.95,0.9495493766458559,,0.18239100312599343,linear,0.5,6,20.0,1.0,64.0,False,False,False,0.018209255780575907,81.0,True,True,0.537307353416587,COMPLETE
228,228,196.6042776,2024-07-02 02:45:59.687450,2024-07-02 03:01:09.860088,0 days 00:15:10.172638,leaky_relu,10.0,0.002989333950094001,1.0,0.9870393933073572,,0.0022367122302242638,linear,2.0,8,100.0,2.0,512.0,True,True,False,0.020494563965717038,65.0,True,False,0.10609653182950723,COMPLETE
229,229,247.366104,2024-07-02 02:48:20.474141,2024-07-02 03:04:57.813707,0 days 00:16:37.339566,tanh,5.0,0.025204112788449102,0.9,0.9592959817871297,,0.01729029570671189,constant,0.9,8,50.0,1.0,512.0,False,True,True,0.06421540097530612,18.0,True,True,0.6055895323522316,COMPLETE
230,230,4.9075,2024-07-02 02:57:00.164846,2024-07-02 03:13:24.803158,0 days 00:16:24.638312,tanh,10.0,3.483856189426497e-06,0.98,0.9681098376607189,,0.07943211680702947,constant,2.0,8,20.0,2.0,8.0,True,False,True,0.011146263715059062,11.0,True,False,0.5231805379999114,COMPLETE
231,231,12.4225944,2024-07-02 03:01:10.390660,2024-07-02 03:16:33.450897,0 days 00:15:23.060237,tanh,5.0,0.0782733868949422,1.0,0.9560859522253637,,0.0017699995438184546,linear,0.9,8,50.0,1.0,128.0,False,True,True,0.010369851432381406,47.0,True,False,0.35565066947319496,COMPLETE
232,232,12.872490199999998,2024-07-02 03:04:57.869203,2024-07-02 03:20:03.329906,0 days 00:15:05.460703,relu,100.0,2.1746522265804626e-06,0.8,0.961249402502514,,0.0004253978256932679,constant,0.9,8,50.0,1.0,128.0,False,False,True,0.08218958221819404,46.0,True,False,0.861539502542729,COMPLETE
233,233,55.305004999999994,2024-07-02 03:13:24.870746,2024-07-02 03:27:54.764178,0 days 00:14:29.893432,tanh,100.0,1.3168918527766813e-06,0.9,0.9856342262300148,,0.4203471593371126,constant,0.9,6,50.0,1.0,32.0,False,True,False,0.005713091485696651,30.0,True,False,0.5932513666426241,COMPLETE
234,234,6.6,2024-07-02 03:16:33.504112,2024-07-02 03:33:41.978989,0 days 00:17:08.474877,tanh,100.0,0.000523741048088789,0.98,0.9920692124368957,,0.19990918942019176,constant,2.0,6,10.0,1.0,128.0,False,True,False,0.0418271576127584,23.0,True,False,0.8520900765186634,COMPLETE
235,235,254.9594222,2024-07-02 03:20:03.396719,2024-07-02 03:34:48.487106,0 days 00:14:45.090387,tanh,5.0,7.204133773576665e-05,0.98,0.9946316277994491,,0.007362010937788642,constant,0.9,8,50.0,1.0,128.0,False,True,True,0.041377296706258705,8.0,True,False,0.4114494294211546,COMPLETE
236,236,272.275536,2024-07-02 03:27:54.819608,2024-07-02 03:44:25.256350,0 days 00:16:30.436742,tanh,50.0,4.399855023341432e-05,0.99,0.9369067443251534,,0.0012980780361332624,linear,0.7,8,20.0,1.0,32.0,False,False,False,0.00021251197024310133,85.0,True,True,0.8361397078634886,COMPLETE
237,237,79.755797,2024-07-02 03:33:42.028579,2024-07-02 03:50:42.297225,0 days 00:17:00.268646,elu,100.0,5.5694343314598456e-05,0.9,0.96214786213398,,0.02526476777203362,linear,0.7,8,20.0,1.0,128.0,False,False,False,0.00023107506475983713,68.0,True,True,0.3569962200120112,COMPLETE
238,238,5.4,2024-07-02 03:34:48.529819,2024-07-02 03:51:39.360344,0 days 00:16:50.830525,elu,100.0,0.00010040296944820352,0.9,0.9494943222537295,,0.1747810046520209,linear,0.7,8,20.0,1.0,128.0,False,False,False,0.0033902904628521136,71.0,True,True,0.03127161110829613,COMPLETE
239,239,270.5384628,2024-07-02 03:44:25.310119,2024-07-02 03:59:49.030748,0 days 00:15:23.720629,relu,10.0,0.08448569976398915,1.0,0.9993975513285878,,0.04423132519761442,linear,2.0,8,100.0,2.0,512.0,False,True,False,0.002754157848849218,40.0,True,False,0.25901131334538413,COMPLETE
240,240,272.97426800000005,2024-07-02 03:50:42.367486,2024-07-02 04:07:19.674634,0 days 00:16:37.307148,tanh,100.0,1.9289227995264996e-05,0.99,0.9407863479924256,,0.0026834183288415568,linear,0.7,8,20.0,1.0,32.0,False,False,False,0.00014290389755053202,69.0,True,True,0.9300736327028277,COMPLETE
241,241,132.49489479999997,2024-07-02 03:51:39.428544,2024-07-02 04:07:55.839138,0 days 00:16:16.410594,tanh,50.0,0.0002886766040298167,0.99,0.9406642395722753,,1.776477899067934e-05,linear,0.7,8,20.0,1.0,32.0,False,False,False,0.0009311832010030852,97.0,True,True,0.8218728564307185,COMPLETE
242,242,61.1373734,2024-07-02 03:59:49.083153,2024-07-02 04:16:10.349031,0 days 00:16:21.265878,tanh,10.0,7.718042542949884e-05,0.99,0.9316596624933046,,5.803125300341581e-05,constant,0.7,8,20.0,1.0,32.0,False,False,False,2.7430534927914776e-05,53.0,True,True,0.9269846285278768,COMPLETE
243,243,215.2473892,2024-07-02 04:07:19.733665,2024-07-02 04:23:55.129894,0 days 00:16:35.396229,tanh,50.0,3.5652823457784764e-06,0.99,0.9206821236358295,,0.0003953287196309159,linear,0.7,8,20.0,1.0,32.0,False,False,False,0.0011482091700333698,91.0,True,True,0.6531758168241325,COMPLETE
244,244,113.8288696,2024-07-02 04:07:55.901165,2024-07-02 04:23:53.466855,0 days 00:15:57.565690,tanh,100.0,1.1990651358982197e-07,0.99,0.9437192567878205,,0.0005077268013084479,linear,0.7,8,20.0,1.0,8.0,False,False,False,0.0006466416011647262,68.0,True,True,0.6704556858529256,COMPLETE
245,245,164.9818902,2024-07-02 04:16:10.414099,2024-07-02 04:32:25.489363,0 days 00:16:15.075264,tanh,5.0,0.006965931881009392,1.0,0.972393000965393,,0.0014046891606470974,constant,0.9,6,50.0,1.0,16.0,False,True,True,0.003136910330781141,8.0,True,True,0.2995624027931745,COMPLETE
246,246,51.6515002,2024-07-02 04:23:53.522442,2024-07-02 04:39:11.117805,0 days 00:15:17.595363,tanh,10.0,0.00018336644647672825,0.98,0.9888953574151268,,0.04075668221425532,constant,0.9,8,50.0,1.0,64.0,True,True,False,0.0013517940584192622,11.0,True,False,0.15042570758290896,COMPLETE
247,247,253.5355168,2024-07-02 04:23:55.166141,2024-07-02 04:39:18.465171,0 days 00:15:23.299030,tanh,5.0,0.008626438941751878,0.9,0.9622100342110299,,0.0006985116337136481,constant,0.3,8,50.0,1.0,512.0,True,True,True,0.024859806262966872,2.0,True,False,0.1759421643760082,COMPLETE
248,248,10.4654162,2024-07-02 04:32:25.546939,2024-07-02 04:46:54.325343,0 days 00:14:28.778404,tanh,100.0,0.0030422652258639458,0.95,0.9583378503778982,,0.012406329504012263,constant,0.3,8,50.0,1.0,128.0,False,True,True,0.045479050876916546,19.0,False,False,0.013453964961361227,COMPLETE
249,249,80.0081154,2024-07-02 04:39:11.182439,2024-07-02 04:55:17.753026,0 days 00:16:06.570587,tanh,100.0,0.032929335681786,0.9,0.9427897403116197,,0.05247050455816164,linear,0.5,8,20.0,1.0,64.0,True,False,False,0.000652842047252523,58.0,True,True,0.006765308977973866,COMPLETE
250,250,52.0792752,2024-07-02 04:39:18.519909,2024-07-02 04:55:31.866323,0 days 00:16:13.346414,relu,10.0,3.7230931854057965e-07,0.98,0.9543911131699742,,0.007705630909890048,constant,0.9,8,50.0,3.0,256.0,False,False,True,0.026007300166103794,9.0,True,False,0.06587830368318875,COMPLETE
251,251,7.3,2024-07-02 04:46:54.384122,2024-07-02 05:06:28.248981,0 days 00:19:33.864859,tanh,100.0,3.9762101599567684e-05,0.99,0.9497628832174638,,0.013872365516035007,linear,0.7,8,5.0,1.0,32.0,False,False,False,1.0171039777286779e-05,57.0,True,True,0.8790141403018932,COMPLETE
252,252,98.683648,2024-07-02 04:55:17.807678,2024-07-02 05:10:58.643357,0 days 00:15:40.835679,tanh,100.0,4.129000326104094e-05,0.99,0.9424023010125578,,0.005920435009364018,linear,0.7,8,20.0,1.0,32.0,False,False,False,6.583437256039019e-05,68.0,True,True,0.9455621466109698,COMPLETE
253,253,124.17233919999998,2024-07-02 04:55:31.914261,2024-07-02 05:11:51.294709,0 days 00:16:19.380448,tanh,50.0,0.03419000183398252,0.9,0.96778250589008,,0.0003092712771805494,linear,1.0,8,20.0,1.0,256.0,False,True,False,0.0003628825390321987,88.0,True,True,0.4881706232065074,COMPLETE
254,254,11.6,2024-07-02 05:06:28.302196,2024-07-02 05:21:15.725365,0 days 00:14:47.423169,relu,50.0,2.3305330952503848e-07,1.0,0.9458587411630561,,8.502333140812024e-05,constant,0.5,8,50.0,3.0,16.0,True,False,True,0.06179621343716552,29.0,True,False,0.5402787541957299,COMPLETE
255,255,257.5179956,2024-07-02 05:10:58.696957,2024-07-02 05:24:49.898771,0 days 00:13:51.201814,elu,10.0,3.5981936865392964e-06,1.0,0.9375036756471549,,0.005665922274882319,constant,0.5,8,50.0,2.0,8.0,True,False,True,0.05121200875624371,3.0,True,False,0.7049035626623187,COMPLETE
256,256,3.8,2024-07-02 05:11:51.341272,2024-07-02 05:33:17.373966,0 days 00:21:26.032694,relu,100.0,0.02679575663488256,0.9,0.9415124835002423,,0.013306116479390706,linear,0.5,8,5.0,1.0,32.0,False,False,False,0.0015023951535328894,70.0,True,True,0.2963698506888229,COMPLETE
257,257,92.56666700000001,2024-07-02 05:21:15.784704,2024-07-02 05:39:01.729861,0 days 00:17:45.945157,tanh,50.0,2.4134155337498333e-05,0.99,0.909961543724081,,0.02162167885582917,linear,0.7,8,20.0,1.0,512.0,False,False,False,0.0007384126689085335,65.0,True,True,0.9742426369971722,COMPLETE
258,258,272.3162918,2024-07-02 05:24:49.952800,2024-07-02 05:39:04.559856,0 days 00:14:14.607056,elu,5.0,8.315473223334002e-07,0.8,0.9759145013288844,,0.0005917525343315315,constant,0.9,8,50.0,2.0,8.0,False,False,True,0.015603542927199687,56.0,True,False,0.6235828097137602,COMPLETE
259,259,11.9,2024-07-02 05:33:17.429035,2024-07-02 05:47:52.319586,0 days 00:14:34.890551,tanh,5.0,0.0016395059468454994,1.0,0.9792483481019919,,0.0008508850137548466,constant,0.5,8,50.0,1.0,8.0,False,True,True,0.04586046530294322,14.0,True,False,0.06564639909181941,COMPLETE
260,260,107.1851162,2024-07-02 05:39:01.781958,2024-07-02 05:55:01.669456,0 days 00:15:59.887498,elu,100.0,8.100766144554798e-05,0.98,0.9993822278219232,,0.10112422168359021,constant,0.9,8,50.0,2.0,64.0,False,False,True,0.06069875174944511,24.0,True,False,0.28022125647351287,COMPLETE
261,261,11.005803799999999,2024-07-02 05:39:04.597259,2024-07-02 05:54:41.046800,0 days 00:15:36.449541,tanh,50.0,0.0006940207189357831,0.95,0.9523902706852364,,0.00013557304540860615,constant,0.9,8,50.0,2.0,16.0,True,False,True,0.012928047088934873,36.0,True,False,0.2997397822856195,COMPLETE
262,262,245.7681172,2024-07-02 05:47:52.380188,2024-07-02 06:03:50.012894,0 days 00:15:57.632706,leaky_relu,5.0,3.153110260112414e-06,0.8,0.9932408586312582,,0.00025938112482027677,constant,0.9,8,50.0,2.0,8.0,False,False,True,0.0013617520450156797,95.0,True,False,0.5482120523584567,COMPLETE
263,263,11.5,2024-07-02 05:54:41.109630,2024-07-02 06:10:09.871502,0 days 00:15:28.761872,elu,50.0,0.00029199342510251595,1.0,0.9293885783774194,,0.0002529080178469408,constant,0.9,8,200.0,2.0,8.0,True,False,True,0.004087491636719105,65.0,True,False,0.4433609576366269,COMPLETE
264,264,11.0,2024-07-02 05:55:01.738420,2024-07-02 06:11:18.489291,0 days 00:16:16.750871,elu,5.0,6.87327095980732e-07,0.8,0.9859354752352286,,0.00023098149853937705,constant,0.9,8,50.0,2.0,8.0,False,False,True,0.0383461335435084,44.0,True,False,0.5311260033773527,COMPLETE
265,265,11.5,2024-07-02 06:03:50.070674,2024-07-02 06:19:23.999428,0 days 00:15:33.928754,tanh,5.0,0.04793018142586092,1.0,0.9516263245786649,,0.00035139866136903283,constant,5.0,8,50.0,1.0,16.0,False,True,True,0.0103840485367619,24.0,True,False,0.10258145331045318,COMPLETE
266,266,297.07587639999997,2024-07-02 06:10:09.934163,2024-07-02 06:27:03.324096,0 days 00:16:53.389933,elu,5.0,1.5755107089997279e-06,0.8,0.9861212613507695,,0.004936547667480505,constant,0.9,8,50.0,2.0,8.0,False,False,True,0.07749184874404398,54.0,True,False,0.5752316684460514,COMPLETE
267,267,7.430081400000001,2024-07-02 06:11:18.547249,2024-07-02 06:27:07.139800,0 days 00:15:48.592551,tanh,5.0,0.0003429339967652712,1.0,0.9848810922619594,,0.022248929051909377,constant,0.9,8,50.0,1.0,256.0,False,True,False,0.002969415076041048,12.0,True,False,0.13036977871309707,COMPLETE
268,268,10.7,2024-07-02 06:19:24.065909,2024-07-02 06:35:09.467773,0 days 00:15:45.401864,elu,100.0,0.00047411779367151336,0.98,0.9896134978261442,,0.0005422227043966441,constant,0.9,8,50.0,2.0,16.0,False,True,True,0.042566165001537065,12.0,True,False,0.6919065727754594,COMPLETE
269,269,237.0755646,2024-07-02 06:27:03.397912,2024-07-02 06:42:24.840372,0 days 00:15:21.442460,elu,50.0,5.421833949127729e-06,0.9,0.9555033760360889,,0.005216519216901428,constant,0.9,8,50.0,2.0,8.0,True,False,True,0.019613889793392045,34.0,True,False,0.4549193940262337,COMPLETE
270,270,266.899122,2024-07-02 06:27:07.179238,2024-07-02 06:43:46.519650,0 days 00:16:39.340412,elu,5.0,9.446089314077687e-05,0.98,0.9495041077369927,,0.007506425024213933,constant,0.9,8,50.0,2.0,128.0,True,False,True,0.055020310935111214,31.0,True,False,0.326683667162168,COMPLETE
271,271,11.55098,2024-07-02 06:35:09.524873,2024-07-02 06:54:25.257494,0 days 00:19:15.732621,tanh,10.0,0.0021448971982875897,0.9,0.9627773421656828,,0.008878997942240566,linear,0.5,8,20.0,1.0,256.0,False,False,False,0.0002875791475525916,82.0,True,True,0.47830548103091425,COMPLETE
272,272,6.7,2024-07-02 06:42:24.888750,2024-07-02 06:57:09.731986,0 days 00:14:44.843236,tanh,100.0,5.354459438069203e-07,0.98,0.9886471426288165,,0.709810027900442,constant,0.9,6,50.0,1.0,128.0,False,False,False,0.023404312477738574,31.0,True,False,0.9587111644134358,COMPLETE
273,273,254.917952,2024-07-02 06:43:46.566566,2024-07-02 06:59:02.025479,0 days 00:15:15.458913,elu,10.0,8.586118150186026e-05,0.99,0.9842670429903698,,0.014923277364533763,constant,0.9,8,50.0,2.0,8.0,False,False,True,0.0753584054263084,38.0,True,False,0.320063551446241,COMPLETE
274,274,12.311111200000001,2024-07-02 06:54:25.316088,2024-07-02 07:11:41.057773,0 days 00:17:15.741685,tanh,5.0,0.03903922217902164,1.0,0.993034028020366,,0.0005541796281812768,constant,5.0,8,50.0,2.0,128.0,False,True,True,0.01731079439010654,10.0,True,False,0.17892794225968273,COMPLETE
275,275,53.9379558,2024-07-02 06:57:09.786684,2024-07-02 07:12:28.111170,0 days 00:15:18.324486,elu,10.0,8.642629442980658e-07,0.8,0.9776196325164392,,0.042946528539988225,constant,1.0,8,50.0,1.0,8.0,False,False,True,0.02832914269523537,81.0,True,False,0.605214779189454,COMPLETE
276,276,269.2549494,2024-07-02 06:59:02.089312,2024-07-02 07:13:57.716484,0 days 00:14:55.627172,tanh,5.0,0.00019660769908440645,1.0,0.9641181795093744,,0.0069717649082281855,constant,1.0,8,200.0,1.0,128.0,False,True,True,0.010740277257737602,18.0,True,False,0.22656942545070524,COMPLETE
277,277,101.509447,2024-07-02 07:11:41.125793,2024-07-02 07:28:26.635959,0 days 00:16:45.510166,tanh,50.0,0.013258806365404812,0.99,0.9420658225242029,,0.004280197127127819,linear,0.5,6,50.0,1.0,64.0,False,False,False,0.0002457593644734703,65.0,False,True,0.26802024995998164,COMPLETE
278,278,46.433333,2024-07-02 07:12:28.167749,2024-07-02 07:31:28.351918,0 days 00:19:00.184169,tanh,50.0,0.00014529183262729323,1.0,0.960842231079542,,0.006645264917615867,constant,0.9,8,10.0,3.0,8.0,True,False,True,0.032067855285196484,17.0,True,False,0.4371104267152602,COMPLETE
279,279,5.1,2024-07-02 07:13:57.770923,2024-07-02 07:28:37.098345,0 days 00:14:39.327422,tanh,5.0,0.00023907355496293977,0.98,0.9910037533096447,,0.16194952171838778,constant,0.9,8,50.0,1.0,128.0,False,True,False,0.0019722939073148517,17.0,True,False,0.7663452583869953,COMPLETE
280,280,233.81414560000002,2024-07-02 07:28:26.691277,2024-07-02 07:44:07.126775,0 days 00:15:40.435498,tanh,5.0,0.06716775589722405,0.9,0.9700205266019976,,0.006993528626174714,linear,0.3,8,50.0,1.0,64.0,False,False,True,0.07089681577063464,18.0,True,False,0.14736850056666048,COMPLETE
281,281,9.1,2024-07-02 07:28:37.131431,2024-07-02 07:44:51.772555,0 days 00:16:14.641124,elu,100.0,2.804594864846352e-06,0.8,0.9489405928168838,,0.00027108711675521296,constant,0.9,6,50.0,2.0,8.0,False,False,True,0.07332219682595414,76.0,True,False,0.3462287705775758,COMPLETE
282,282,11.0,2024-07-02 07:31:28.396897,2024-07-02 07:47:29.455883,0 days 00:16:01.058986,elu,100.0,9.859697874828316e-07,0.98,0.9875154870374203,,3.4459235754965575e-05,constant,0.9,8,50.0,2.0,8.0,False,False,True,0.018035573036132374,14.0,True,False,0.2539280715066221,COMPLETE
283,283,11.36,2024-07-02 07:44:07.187478,2024-07-02 07:59:18.895387,0 days 00:15:11.707909,elu,50.0,0.00020958499591952493,0.98,0.9939081487947816,,0.0006266271838525464,constant,0.9,8,50.0,2.0,8.0,False,False,True,0.02001504010444583,10.0,True,False,0.3681360575248826,COMPLETE
284,284,289.9625668,2024-07-02 07:44:51.839953,2024-07-02 08:04:49.202940,0 days 00:19:57.362987,tanh,50.0,0.0034634673155717432,0.9,0.942761646097748,,0.009748344313164948,linear,2.0,8,20.0,2.0,32.0,False,False,False,0.006296186945327793,56.0,True,True,0.2790523625754341,COMPLETE
285,285,272.8772874,2024-07-02 07:47:29.511468,2024-07-02 08:02:26.299574,0 days 00:14:56.788106,tanh,10.0,0.0002990364961760604,0.98,0.9823159733565402,,0.019498483895973646,constant,0.3,8,200.0,2.0,8.0,True,False,True,0.09010892569888443,23.0,True,False,0.5266950598287796,COMPLETE
286,286,10.103961600000002,2024-07-02 07:59:18.945104,2024-07-02 08:14:26.130413,0 days 00:15:07.185309,tanh,100.0,1.1008539424216905e-05,0.98,0.9656701035701362,,0.4064772183319066,constant,0.7,6,50.0,1.0,64.0,False,True,False,0.03448468583885374,13.0,True,False,0.6308666339794885,COMPLETE
287,287,229.4036532,2024-07-02 08:02:26.360158,2024-07-02 08:18:29.952020,0 days 00:16:03.591862,tanh,10.0,0.00028090174010413077,0.98,0.9792657353428925,,0.044356809146291684,constant,0.3,8,200.0,2.0,128.0,True,False,True,0.08109691502990798,29.0,True,False,0.6619822640698115,COMPLETE
288,288,10.2,2024-07-02 08:04:49.264769,2024-07-02 08:19:42.737107,0 days 00:14:53.472338,elu,5.0,0.014766231823381356,1.0,0.93947183091579,,0.000348547050158707,constant,0.9,8,50.0,1.0,8.0,True,False,True,0.056101914170680285,35.0,True,False,0.6371316865261388,COMPLETE
289,289,76.064377,2024-07-02 08:14:26.192257,2024-07-02 08:32:31.241865,0 days 00:18:05.049608,tanh,50.0,0.012088917823857447,0.9,0.9450973411994826,,0.04997632915336504,linear,2.0,8,20.0,2.0,32.0,False,False,False,0.006889802197847738,57.0,True,True,0.05513135349747256,COMPLETE
290,290,42.91882940000001,2024-07-02 08:18:30.010309,2024-07-02 08:34:46.773264,0 days 00:16:16.762955,tanh,50.0,2.1886891478840428e-05,0.9,0.9321913860855955,,0.02436235669176117,linear,2.0,8,50.0,2.0,32.0,False,False,False,0.003745309373435144,46.0,True,True,0.3343189461183186,COMPLETE
291,291,4.5,2024-07-02 08:19:42.794571,2024-07-02 08:37:12.932996,0 days 00:17:30.138425,tanh,50.0,0.00219305174264181,0.9,0.9400747079921357,,0.28407954392407453,linear,2.0,8,20.0,2.0,32.0,False,False,False,0.011868102701240585,44.0,True,True,0.17413371042079862,COMPLETE
292,292,270.384906,2024-07-02 08:32:31.301046,2024-07-02 08:50:04.113506,0 days 00:17:32.812460,tanh,50.0,0.016928600548497243,0.99,0.9301303584780591,,0.0035640564407528603,linear,0.7,8,20.0,1.0,512.0,False,False,False,0.00013126355467071355,96.0,False,True,0.5778290224130311,COMPLETE
293,293,312.70056179999995,2024-07-02 08:34:46.812846,2024-07-02 08:51:45.654486,0 days 00:16:58.841640,leaky_relu,50.0,0.000282641124565721,0.99,0.9092720154921844,,0.0003709257637251327,linear,0.7,8,20.0,1.0,512.0,False,True,False,0.0001867189366538232,75.0,True,True,0.6160354968966596,COMPLETE
294,294,8.1,2024-07-02 08:37:12.977098,2024-07-02 08:51:57.430068,0 days 00:14:44.452970,elu,50.0,2.3558661927712638e-05,1.0,0.9516782454096916,,0.12785309452173318,constant,0.5,8,50.0,2.0,64.0,True,False,True,0.00980966937790824,27.0,False,False,0.1791838529346383,COMPLETE
295,295,156.4374894,2024-07-02 08:50:04.179333,2024-07-02 09:05:18.015579,0 days 00:15:13.836246,elu,10.0,0.0002457282790599709,0.92,0.916199671420304,,0.000136469410961176,linear,0.9,8,200.0,1.0,512.0,False,False,False,0.00029764134649634184,83.0,True,True,0.9486544169575896,COMPLETE
296,296,3.2,2024-07-02 08:51:45.715323,2024-07-02 09:08:04.149143,0 days 00:16:18.433820,elu,5.0,2.3917049501483524e-07,0.8,0.9898748780049068,,0.17993002601538358,constant,0.9,8,20.0,2.0,64.0,False,False,True,0.020141285919087964,70.0,True,False,0.41804032157436394,COMPLETE
297,297,230.685764,2024-07-02 08:51:57.480999,2024-07-02 09:09:37.808610,0 days 00:17:40.327611,leaky_relu,50.0,0.002557470986485617,0.99,0.9122485221644563,,0.0007227047519155814,linear,0.7,8,20.0,1.0,512.0,False,True,False,0.006672784790260989,65.0,True,True,0.451151635993104,COMPLETE
298,298,235.2512618,2024-07-02 09:05:18.061081,2024-07-02 09:21:52.146728,0 days 00:16:34.085647,elu,50.0,0.0004832915726089481,1.0,0.9352957674860825,,0.0009797340186224292,constant,0.9,8,50.0,2.0,256.0,True,False,True,0.00452725859237293,19.0,True,False,0.4606095413565506,COMPLETE
299,299,254.9423252,2024-07-02 09:08:04.200059,2024-07-02 09:22:57.197865,0 days 00:14:52.997806,tanh,10.0,0.019645200750627312,0.98,0.9539041585848965,,0.00532300132805382,constant,0.5,8,200.0,2.0,8.0,True,False,True,0.005376352891349898,47.0,True,False,0.4086762182391836,COMPLETE
