,number,value,datetime_start,datetime_complete,duration,params_activation_fn,params_clip_obs,params_ent_coef,params_gae_lambda,params_gamma,params_initialization_strategy,params_learning_rate,params_lr_schedule,params_max_grad_norm,params_max_ingredients,params_n_steps,params_net_arch_depth,params_net_arch_width,params_norm_reward,params_normalize_advantage,params_ortho_init,params_rms_prop_eps,params_sde_sample_freq,params_use_rms_prop,params_use_sde,params_vf_coef,state
375,375,3.3,2024-07-02 15:43:56.230269,2024-07-02 15:58:39.359109,0 days 00:14:43.128840,tanh,5.0,0.0003910343207497666,0.95,0.9987629401283397,,0.47662620857643895,constant,5.0,8,50.0,2.0,128.0,False,True,False,0.022469853077481155,36.0,True,False,0.3453514431320079,COMPLETE
376,376,257.0341796,2024-07-02 15:44:38.566841,2024-07-02 16:01:47.413409,0 days 00:17:08.846568,elu,50.0,0.008276027098334094,0.99,0.9256422109733702,,0.028018736073944055,linear,0.3,8,20.0,1.0,128.0,False,False,False,0.0002992285351290857,48.0,True,True,0.5984556274632346,COMPLETE
377,377,224.47957419999997,2024-07-02 15:49:50.815518,2024-07-02 16:05:43.595287,0 days 00:15:52.779769,tanh,50.0,0.005607242618728653,0.98,0.9858641717722273,,0.8070149220815824,constant,0.5,8,50.0,2.0,512.0,False,True,True,0.03191925404040498,6.0,True,False,0.3963671370143873,COMPLETE
378,378,257.010922,2024-07-02 15:58:39.413405,2024-07-02 16:12:07.888289,0 days 00:13:28.474884,leaky_relu,5.0,0.0010493410937649108,0.98,0.9720755137802881,,0.01709964478169477,constant,0.3,8,200.0,1.0,8.0,False,False,True,0.006799693622149747,29.0,True,False,0.8272507474652413,COMPLETE
379,379,7.8,2024-07-02 16:01:47.486042,2024-07-02 16:22:03.121961,0 days 00:20:15.635919,tanh,100.0,0.0043832784968855535,0.98,0.9791923520069341,,0.002496803168004606,constant,0.3,8,5.0,2.0,8.0,True,True,True,0.05184899966198635,13.0,True,False,0.03274993961605294,COMPLETE
380,380,7.52475,2024-07-02 16:05:43.649976,2024-07-02 16:20:33.321559,0 days 00:14:49.671583,relu,10.0,0.04270157016816495,0.8,0.928137683541984,,0.16284142592258846,constant,0.5,6,20.0,1.0,64.0,False,False,False,0.0012909888498443879,70.0,True,True,0.7107340840116636,PRUNED
381,381,201.732308,2024-07-02 16:12:07.935156,2024-07-02 16:27:25.725845,0 days 00:15:17.790689,leaky_relu,10.0,0.004971748586718466,0.8,0.9693041337540875,,0.011609317143577783,constant,0.5,6,50.0,2.0,64.0,False,True,True,0.05226310442877257,32.0,True,False,0.3376461163748038,COMPLETE
382,382,269.8519228,2024-07-02 16:20:33.369223,2024-07-02 16:36:07.375919,0 days 00:15:34.006696,elu,5.0,0.00043738728969757357,0.98,0.9808693509270077,,0.3013976846569235,constant,0.3,8,50.0,2.0,8.0,False,True,True,0.0084592479535378,35.0,True,False,0.532283372568016,COMPLETE
383,383,102.1779002,2024-07-02 16:22:03.182767,2024-07-02 16:36:48.538940,0 days 00:14:45.356173,tanh,100.0,3.391889316620744e-05,0.92,0.9885665576254312,,0.7231127912902233,constant,0.5,6,50.0,1.0,128.0,False,True,False,0.013773595002798367,27.0,True,False,0.5847277159337789,COMPLETE
384,384,11.604717,2024-07-02 16:27:25.786950,2024-07-02 16:45:17.762347,0 days 00:17:51.975397,relu,10.0,3.0003343871493973e-06,0.92,0.9059354500794028,,0.001873597765271791,linear,5.0,8,20.0,1.0,512.0,False,False,False,0.00045956370298649613,96.0,True,True,0.9833208516688509,COMPLETE
385,385,268.4484354,2024-07-02 16:36:07.441593,2024-07-02 16:50:33.576740,0 days 00:14:26.135147,leaky_relu,5.0,0.09172185332048494,0.8,0.9644559314019172,,0.012645777080197852,constant,0.9,6,50.0,2.0,128.0,False,True,True,0.09807540992292366,46.0,True,False,0.2723801108420336,COMPLETE
386,386,16.6575,2024-07-02 16:36:48.588724,2024-07-02 16:55:14.556913,0 days 00:18:25.968189,leaky_relu,50.0,0.00035381536793001675,1.0,0.9211646941693907,,1.2353489186058364e-05,linear,5.0,8,10.0,1.0,512.0,False,True,False,0.0003483256815828053,80.0,True,True,0.5469706866119975,COMPLETE
387,387,11.0928218,2024-07-02 16:45:17.825491,2024-07-02 17:00:37.040303,0 days 00:15:19.214812,tanh,5.0,0.01970323919189855,1.0,0.9758273810005782,,0.0029669054059568104,constant,0.9,8,10.0,1.0,128.0,False,True,True,0.08940976640537544,14.0,True,False,0.0542833852170464,COMPLETE
388,388,274.26835919999996,2024-07-02 16:50:33.635330,2024-07-02 17:07:30.747749,0 days 00:16:57.112419,tanh,10.0,0.004303512447738762,0.98,0.9711815998551451,,0.0040086516292177354,constant,0.3,8,20.0,1.0,128.0,False,True,True,0.043694142116577225,16.0,True,True,0.3830352267748237,COMPLETE
389,389,11.5,2024-07-02 16:55:14.600930,2024-07-02 17:11:13.380442,0 days 00:15:58.779512,tanh,5.0,0.005636078654806789,0.98,0.9750627982848595,,0.0015729661650446495,constant,0.3,8,200.0,1.0,16.0,False,True,True,0.03278679981116435,2.0,True,True,0.070093630636276,COMPLETE
390,390,223.906081,2024-07-02 17:00:37.105534,2024-07-02 17:15:17.447623,0 days 00:14:40.342089,leaky_relu,10.0,0.09231850573307404,1.0,0.9828853744166438,,0.020043714441728432,linear,0.5,6,200.0,2.0,512.0,False,True,False,0.0006530038985516533,33.0,True,False,0.19206395605708756,COMPLETE
391,391,213.5186714,2024-07-02 17:07:30.805592,2024-07-02 17:22:06.875055,0 days 00:14:36.069463,elu,100.0,0.00020609676724860155,0.98,0.9850636843540707,,0.0027438885534683865,constant,0.9,8,100.0,3.0,8.0,False,False,False,0.01769677956056863,29.0,True,False,0.027927101114383457,COMPLETE
392,392,10.1,2024-07-02 17:11:13.431322,2024-07-02 17:28:25.602288,0 days 00:17:12.170966,tanh,10.0,1.0374605409449346e-05,0.98,0.9415842640891727,,0.0002270452007818382,constant,0.3,8,50.0,1.0,128.0,False,True,True,0.00843990084025951,3.0,True,True,0.761928420628103,COMPLETE
393,393,254.53094040000002,2024-07-02 17:15:17.502908,2024-07-02 17:32:38.298336,0 days 00:17:20.795428,tanh,10.0,0.0027643725150510016,0.98,0.9786413519752686,,0.0015014716629094878,constant,0.3,8,20.0,1.0,128.0,False,True,True,0.004842382220682671,20.0,True,True,0.7103729746561828,COMPLETE
394,394,3.2,2024-07-02 17:22:06.929154,2024-07-02 17:36:04.073812,0 days 00:13:57.144658,tanh,5.0,0.0003015121852411186,0.98,0.9768669973685591,,0.2907492525454989,constant,0.3,8,100.0,2.0,8.0,True,False,True,0.0040677095158896896,7.0,True,False,0.062441329064677184,COMPLETE
395,395,10.5,2024-07-02 17:28:25.676081,2024-07-02 17:46:36.478622,0 days 00:18:10.802541,tanh,10.0,0.00263847398534223,0.98,0.9370481432138951,,3.8421596539260294e-05,constant,0.3,8,20.0,1.0,128.0,False,True,True,0.07068215396251802,18.0,False,True,0.17374012430323946,COMPLETE
396,396,270.889494,2024-07-02 17:32:38.355948,2024-07-02 17:46:34.491216,0 days 00:13:56.135268,leaky_relu,50.0,3.765387717335329e-05,0.98,0.9720608479269592,,0.008171480377624472,constant,0.3,8,100.0,1.0,8.0,True,False,True,0.00725448953690679,16.0,True,False,0.7288879022360176,COMPLETE
397,397,12.5,2024-07-02 17:36:04.136428,2024-07-02 17:52:21.420404,0 days 00:16:17.283976,relu,10.0,0.00823916593960559,0.98,0.9723424035655478,,0.0005516626117801581,constant,0.3,8,100.0,1.0,128.0,False,True,True,0.021276402504650085,43.0,True,True,0.09746077610290071,COMPLETE
398,398,11.38,2024-07-02 17:46:34.555269,2024-07-02 18:00:24.199401,0 days 00:13:49.644132,tanh,5.0,0.0025407039600807593,0.98,0.9959875310587886,,0.004667799536653125,constant,0.3,6,50.0,1.0,16.0,False,True,True,0.05414697080059395,2.0,True,False,0.17166843748196864,COMPLETE
399,399,144.3761524,2024-07-02 17:46:36.518085,2024-07-02 18:04:07.780673,0 days 00:17:31.262588,leaky_relu,100.0,0.02039596534738217,0.99,0.9064217183535056,,0.00030126255661314073,linear,0.7,8,20.0,1.0,512.0,False,True,False,2.144016141766479e-05,77.0,True,True,0.6046583038403955,COMPLETE
400,400,41.832083,2024-07-02 17:52:21.473406,2024-07-02 18:11:24.412821,0 days 00:19:02.939415,leaky_relu,10.0,0.05594013198397675,1.0,0.9796537228644882,,0.045780198924124126,linear,2.0,8,10.0,2.0,512.0,False,True,False,0.005406319840289876,57.0,True,False,0.18287947125088727,COMPLETE
401,401,269.5904048,2024-07-02 18:00:24.242935,2024-07-02 18:15:35.531567,0 days 00:15:11.288632,tanh,5.0,0.0027416137281866017,0.98,0.9772030403470866,,0.001699272800772987,constant,0.3,8,20.0,1.0,128.0,False,True,True,0.03235734171176702,5.0,True,False,0.03943180167634701,COMPLETE
402,402,274.11595040000003,2024-07-02 18:04:07.824159,2024-07-02 18:22:00.868128,0 days 00:17:53.043969,tanh,10.0,0.00016227730322120664,0.98,0.9659204466175995,,0.0017116529572217788,constant,0.3,6,20.0,1.0,64.0,False,True,True,0.014437608868257823,12.0,True,True,0.19472362070421204,COMPLETE
403,403,259.4388354,2024-07-02 18:11:24.472905,2024-07-02 18:26:04.511257,0 days 00:14:40.038352,tanh,50.0,2.1864440657846083e-06,0.98,0.995126114168645,,0.01898275389831504,constant,5.0,6,50.0,1.0,128.0,False,True,False,0.08260657599729447,35.0,True,False,0.6007628519921904,COMPLETE
404,404,220.54959760000003,2024-07-02 18:15:35.603127,2024-07-02 18:32:22.014367,0 days 00:16:46.411240,elu,100.0,0.00022686964516622701,0.99,0.9447815675349855,,0.00015056364860396252,constant,0.9,8,20.0,2.0,8.0,True,False,True,0.040264069507729386,31.0,False,False,0.49075340627928826,COMPLETE
405,405,14.248602199999999,2024-07-02 18:22:00.940130,2024-07-02 18:39:35.083002,0 days 00:17:34.142872,tanh,10.0,2.6347448811166346e-05,0.8,0.9680832576567752,,0.00029824746941812456,constant,0.3,6,20.0,1.0,64.0,False,True,True,0.012616570638369535,17.0,True,True,0.1749102996899141,COMPLETE
406,406,259.6864356,2024-07-02 18:26:04.568917,2024-07-02 18:40:05.200170,0 days 00:14:00.631253,tanh,5.0,0.04461537411187922,1.0,0.9874832230102929,,0.0011873377500575598,constant,1.0,8,100.0,1.0,128.0,True,True,True,0.005807147457770785,8.0,True,False,0.1239567843770009,COMPLETE
407,407,262.190566,2024-07-02 18:32:22.080443,2024-07-02 18:50:04.769785,0 days 00:17:42.689342,tanh,10.0,7.019807955314562e-06,0.98,0.9580451847926014,,0.007568797856122754,constant,5.0,6,20.0,1.0,64.0,False,True,True,0.0010171011749144634,23.0,True,True,0.23732484622544733,COMPLETE
408,408,10.64,2024-07-02 18:39:35.137110,2024-07-02 18:54:12.406328,0 days 00:14:37.269218,elu,5.0,5.857581751003446e-08,0.95,0.9972439550358982,,0.003244816911964405,constant,0.9,8,100.0,3.0,8.0,False,True,True,0.038490337631411,64.0,True,False,0.45434584794507016,COMPLETE
409,409,198.09425499999998,2024-07-02 18:40:05.259225,2024-07-02 18:58:00.497100,0 days 00:17:55.237875,tanh,10.0,0.00023038965217378522,0.98,0.9438692666168855,,0.0400903983226709,constant,0.3,6,20.0,2.0,16.0,False,True,True,0.004173686825218445,3.0,True,True,0.3912024852641034,COMPLETE
410,410,233.5583972,2024-07-02 18:50:04.821455,2024-07-02 19:06:48.740643,0 days 00:16:43.919188,tanh,100.0,0.0014302197907570993,0.99,0.9377400309912315,,0.0037133886800496565,linear,0.7,6,20.0,1.0,512.0,False,False,False,0.004672987760129155,43.0,True,True,0.7160963275603619,COMPLETE
411,411,59.921410800000004,2024-07-02 18:54:12.449830,2024-07-02 19:10:55.329523,0 days 00:16:42.879693,leaky_relu,50.0,0.0004720194338214446,0.99,0.9539975541697798,,0.0008417242989134193,linear,5.0,8,20.0,1.0,512.0,False,False,False,0.00010076146712342851,50.0,True,True,0.7868939760717308,COMPLETE
412,412,10.0,2024-07-02 18:58:00.556149,2024-07-02 19:11:08.603254,0 days 00:13:08.047105,tanh,5.0,0.020525145700734052,0.98,0.9969465459668475,,0.001095150088569469,linear,0.3,8,50.0,1.0,512.0,False,True,True,0.039300013261385526,3.0,True,False,0.4725832140742438,COMPLETE
413,413,15.500884600000001,2024-07-02 19:06:48.809380,2024-07-02 19:21:31.985664,0 days 00:14:43.176284,tanh,10.0,1.6538322193194643e-05,0.98,0.9569582372367622,,0.0008844682330625816,constant,0.3,6,20.0,1.0,32.0,False,True,True,0.007931010880767175,27.0,True,True,0.07383353215761661,COMPLETE
414,414,58.7477832,2024-07-02 19:10:55.392055,2024-07-02 19:25:45.081957,0 days 00:14:49.689902,relu,50.0,0.009089283736562719,0.98,0.9737179111726603,,0.025400982313231877,constant,0.3,6,20.0,1.0,64.0,False,True,True,0.015609127978664358,17.0,True,True,0.45759481393571644,COMPLETE
415,415,50.9694028,2024-07-02 19:11:08.650811,2024-07-02 19:31:33.728728,0 days 00:20:25.077917,tanh,10.0,2.5796881017501773e-05,0.98,0.9204615105538215,,0.00011304623105465574,constant,0.3,6,5.0,1.0,64.0,False,True,True,0.016034692058535395,19.0,True,True,0.23681110949223405,COMPLETE
416,416,12.2,2024-07-02 19:21:32.033621,2024-07-02 19:36:38.999714,0 days 00:15:06.966093,tanh,10.0,0.007861440970610601,0.98,0.9575494715757039,,0.0032711332684611603,constant,0.3,6,100.0,1.0,64.0,False,True,True,0.01595661714358232,32.0,True,True,0.15371414031888767,COMPLETE
417,417,291.7633142,2024-07-02 19:25:45.146799,2024-07-02 19:39:26.144591,0 days 00:13:40.997792,relu,5.0,0.024738483472833844,0.98,0.9953759196581149,,0.10182902489785768,constant,0.3,8,100.0,1.0,8.0,False,True,True,0.07116502505326537,21.0,True,False,0.16422109924927872,COMPLETE
418,418,38.8956514,2024-07-02 19:31:33.795491,2024-07-02 19:35:53.207674,0 days 00:04:19.412183,tanh,100.0,0.09476295705514423,0.98,0.9649821805748278,,0.8372045549551332,constant,0.3,8,200.0,2.0,8.0,False,True,True,0.03233806495173764,4.0,False,False,0.32732570397061456,PRUNED
419,419,98.497799,2024-07-02 19:35:53.271616,2024-07-02 19:53:59.644301,0 days 00:18:06.372685,leaky_relu,10.0,0.020246508644109235,0.8,0.9657928539438398,,0.003941947597953003,constant,0.9,8,50.0,2.0,128.0,False,True,True,0.014733997715254134,43.0,True,True,0.15402716422280247,COMPLETE
420,420,266.0690644,2024-07-02 19:36:39.058684,2024-07-02 19:50:45.794205,0 days 00:14:06.735521,tanh,5.0,0.07330545885913266,0.98,0.9998159638886671,,0.12304481566535312,constant,0.3,8,50.0,1.0,32.0,False,True,True,0.059585899432304704,5.0,True,False,0.050279711888718735,COMPLETE
421,421,192.8028502,2024-07-02 19:39:26.200596,2024-07-02 19:53:42.659954,0 days 00:14:16.459358,relu,5.0,0.035438298729703506,0.98,0.9690930290796985,,0.7753834112661185,constant,0.3,8,100.0,1.0,8.0,False,True,True,0.05726507226364605,38.0,True,False,0.267800121858472,COMPLETE
422,422,277.6527394,2024-07-02 19:50:45.853891,2024-07-02 20:04:31.827131,0 days 00:13:45.973240,relu,5.0,0.0043095604631743925,0.98,0.9876497615208045,,0.03432717306037784,constant,0.3,8,100.0,1.0,512.0,False,True,True,0.023069223174952677,34.0,True,False,0.18758737236387255,COMPLETE
423,423,193.3371928,2024-07-02 19:53:42.720280,2024-07-02 20:09:04.089170,0 days 00:15:21.368890,leaky_relu,10.0,0.01003482556091954,1.0,0.9962196966336238,,0.0009025738582553981,linear,0.3,8,100.0,2.0,512.0,False,True,False,0.061903348459732804,14.0,True,False,0.43372917805485106,COMPLETE
424,424,101.0567476,2024-07-02 19:53:59.710173,2024-07-02 20:13:09.940633,0 days 00:19:10.230460,elu,10.0,0.02204907715943014,0.8,0.9726106871582765,,4.43276691420039e-05,constant,0.9,8,10.0,2.0,128.0,False,True,True,0.012993144678227361,11.0,True,False,0.19662479476507858,COMPLETE
425,425,11.290599199999999,2024-07-02 20:04:31.896920,2024-07-02 20:18:42.919976,0 days 00:14:11.023056,leaky_relu,5.0,0.014295862207529543,1.0,0.9946103357253658,,0.0005034500578947275,constant,5.0,6,50.0,1.0,128.0,False,True,False,0.0564765614999326,16.0,True,False,0.43024238770235523,COMPLETE
426,426,12.0,2024-07-02 20:09:04.162582,2024-07-02 20:25:26.892864,0 days 00:16:22.730282,relu,5.0,0.0030291149770175535,0.98,0.9826156535091862,,0.003728125720182877,constant,0.3,8,100.0,2.0,512.0,False,True,True,0.08388918534035027,59.0,True,False,0.021056100089742347,COMPLETE
427,427,253.05853660000002,2024-07-02 20:13:10.007712,2024-07-02 20:28:56.288370,0 days 00:15:46.280658,tanh,10.0,0.0024810902151049335,1.0,0.9733028804008721,,0.0213712521148881,constant,0.9,8,50.0,1.0,128.0,False,True,True,0.01338592301661742,15.0,True,False,0.7318694698681979,COMPLETE
428,428,199.52290039999997,2024-07-02 20:18:42.974824,2024-07-02 20:33:54.048203,0 days 00:15:11.073379,relu,5.0,0.0005969543271583218,0.98,0.9822634304459478,,0.003660074201687052,constant,0.3,8,100.0,1.0,512.0,False,True,True,0.007658522645045048,60.0,False,False,0.45469144130008776,COMPLETE
429,429,11.26,2024-07-02 20:25:26.969322,2024-07-02 20:40:52.658852,0 days 00:15:25.689530,tanh,10.0,0.03888977284069969,0.98,0.9934293415596497,,0.0012968078770739704,constant,0.3,8,50.0,1.0,128.0,False,True,True,0.02125005568327576,45.0,True,False,0.049989209631031754,COMPLETE
430,430,250.2,2024-07-02 20:28:56.341485,2024-07-02 20:44:23.523082,0 days 00:15:27.181597,leaky_relu,5.0,0.05077837343927132,0.95,0.9916036099651873,,0.00956811752548418,linear,2.0,8,100.0,1.0,512.0,False,True,False,0.001309709945028826,48.0,True,False,0.4602874302452171,COMPLETE
431,431,5.2,2024-07-02 20:33:54.110795,2024-07-02 20:48:50.181822,0 days 00:14:56.071027,relu,100.0,0.032591006582426384,0.98,0.9730374160306786,,0.0735983052080018,constant,5.0,8,100.0,1.0,512.0,False,True,True,0.01890396106101739,27.0,True,False,0.014959535202627577,COMPLETE
432,432,8.327867800000002,2024-07-02 20:40:52.715152,2024-07-02 20:55:53.548526,0 days 00:15:00.833374,leaky_relu,10.0,0.0007949416008315087,0.95,0.9861363769672964,,0.016398373802323098,linear,2.0,8,100.0,2.0,128.0,False,True,False,0.004036131163612627,47.0,False,False,0.11136024853432819,COMPLETE
433,433,12.9537722,2024-07-02 20:44:23.583717,2024-07-02 21:02:37.712204,0 days 00:18:14.128487,tanh,100.0,5.4637420675243194e-05,0.98,0.9653486900910547,,9.944190200036936e-05,constant,0.3,6,20.0,2.0,64.0,True,True,True,0.010476532500805658,36.0,True,True,0.3076227904797784,COMPLETE
434,434,55.28352160000001,2024-07-02 20:48:50.236285,2024-07-02 21:07:02.826490,0 days 00:18:12.590205,relu,10.0,0.0025003464363409934,0.98,0.9848640683517018,,0.10616394043722367,constant,0.3,8,5.0,1.0,512.0,False,True,True,0.04417055302676192,23.0,True,False,0.15734766499104502,COMPLETE
435,435,12.0,2024-07-02 20:55:53.603521,2024-07-02 21:09:10.112779,0 days 00:13:16.509258,relu,5.0,0.03003943139974148,1.0,0.9899879642512297,,0.000629769343266081,constant,0.9,8,50.0,1.0,128.0,False,True,True,0.009440075440776031,8.0,True,False,0.5856269560825027,COMPLETE
436,436,10.4,2024-07-02 21:02:37.785291,2024-07-02 21:26:09.421066,0 days 00:23:31.635775,tanh,10.0,0.0004656244382241983,0.95,0.9655325469264129,,0.08016003240020057,constant,0.3,8,5.0,1.0,8.0,False,True,True,0.04192930758974211,1.0,True,True,0.38080791634220884,COMPLETE
437,437,10.6,2024-07-02 21:07:02.884827,2024-07-02 21:20:14.975212,0 days 00:13:12.090385,relu,5.0,0.003164515725393152,0.98,0.9965660417252112,,0.004884065057586132,constant,0.3,8,200.0,1.0,64.0,False,True,True,0.09095758900865045,11.0,True,False,0.17298289307461032,COMPLETE
438,438,10.0,2024-07-02 21:09:10.180213,2024-07-02 21:24:38.261222,0 days 00:15:28.081009,leaky_relu,10.0,0.040934362277873004,0.92,0.9632079099398825,,2.9480966225096852e-05,constant,0.7,8,50.0,2.0,128.0,False,True,True,0.015448532701130769,38.0,True,False,0.017214377601103448,COMPLETE
439,439,11.5,2024-07-02 21:20:15.040888,2024-07-02 21:33:38.777577,0 days 00:13:23.736689,relu,5.0,0.002735149553132822,1.0,0.9786671721783253,,0.002320812064403383,constant,5.0,8,100.0,1.0,32.0,False,True,True,0.06264582255734744,30.0,True,False,0.26284794820618473,COMPLETE
440,440,12.6501038,2024-07-02 21:24:38.321692,2024-07-02 21:41:22.608932,0 days 00:16:44.287240,elu,5.0,1.3298397934439957e-05,0.8,0.9825120826790613,,0.0031075357757783324,constant,0.7,8,50.0,2.0,8.0,False,False,True,0.09152591500081537,66.0,False,True,0.3849037300218324,COMPLETE
441,441,99.05379740000001,2024-07-02 21:26:09.484695,2024-07-02 21:44:28.254429,0 days 00:18:18.769734,tanh,10.0,4.130610374741168e-05,0.98,0.9482377653552663,,0.008630602252319076,linear,2.0,8,20.0,1.0,128.0,False,True,True,0.05951660836539987,8.0,True,True,0.10240064318271436,COMPLETE
442,442,12.316049,2024-07-02 21:33:38.841753,2024-07-02 21:47:14.572351,0 days 00:13:35.730598,tanh,50.0,0.0014969509654691813,0.98,0.9870712082571116,,0.007717762607302548,constant,0.3,8,200.0,1.0,8.0,False,False,True,0.015288686564777025,29.0,True,False,0.8285749273914285,COMPLETE
443,443,270.384906,2024-07-02 21:41:22.675664,2024-07-02 21:59:11.168670,0 days 00:17:48.493006,elu,10.0,5.7909089781977484e-05,0.92,0.9173911275766907,,0.005491280351891039,constant,0.3,8,20.0,1.0,512.0,False,False,False,0.00042791236258805666,89.0,True,True,0.7817398251300982,COMPLETE
444,444,238.8752716,2024-07-02 21:44:28.314948,2024-07-02 22:00:53.145417,0 days 00:16:24.830469,tanh,10.0,0.0023193505257532465,0.98,0.9910912745818291,,0.0012112763166855747,linear,0.3,6,20.0,1.0,64.0,False,True,True,0.0029881703938758283,16.0,True,True,0.13379766242289717,COMPLETE
445,445,238.250227,2024-07-02 21:47:14.638667,2024-07-02 22:02:54.317935,0 days 00:15:39.679268,tanh,10.0,0.004997373939711348,0.98,0.9798874263803015,,0.05254082611970522,constant,0.7,6,20.0,1.0,8.0,False,True,True,0.04463095110738601,18.0,True,True,0.12358859566026695,COMPLETE
446,446,270.81264500000003,2024-07-02 21:59:11.234229,2024-07-02 22:14:31.424806,0 days 00:15:20.190577,elu,100.0,0.0010673824121195088,0.98,0.9728834045254958,,0.001160553419863918,constant,1.0,6,50.0,2.0,8.0,False,False,True,0.04310941745010125,20.0,True,False,0.5264340095905448,COMPLETE
447,447,220.6075924,2024-07-02 22:00:53.203995,2024-07-02 22:15:39.220511,0 days 00:14:46.016516,tanh,5.0,0.08610909249464745,0.9,0.9919903435394838,,0.002797186872315037,constant,5.0,8,50.0,1.0,64.0,False,True,True,0.06116827061646433,19.0,True,False,0.11409828187878268,COMPLETE
448,448,245.64782760000003,2024-07-02 22:02:54.378429,2024-07-02 22:21:27.326365,0 days 00:18:32.947936,elu,100.0,2.6200794231520184e-06,0.92,0.9194120433370454,,0.00041568920941743664,linear,0.7,8,20.0,1.0,512.0,False,True,False,0.00274967609074875,65.0,True,True,0.9031664931334535,COMPLETE
449,449,54.683914,2024-07-02 22:14:31.483754,2024-07-02 22:33:15.776919,0 days 00:18:44.293165,elu,10.0,0.003356341768755971,0.8,0.9855505235858294,,0.002381943327752716,constant,5.0,8,20.0,1.0,128.0,False,True,True,0.004775918907889871,33.0,True,True,0.2808000302294233,COMPLETE
