,number,value,datetime_start,datetime_complete,duration,params_activation_fn,params_clip_obs,params_ent_coef,params_gae_lambda,params_gamma,params_initialization_strategy,params_learning_rate,params_lr_schedule,params_max_grad_norm,params_max_ingredients,params_n_steps,params_net_arch_depth,params_net_arch_width,params_norm_reward,params_normalize_advantage,params_ortho_init,params_rms_prop_eps,params_sde_sample_freq,params_use_rms_prop,params_use_sde,params_vf_coef,state
300,300,82.84186300000002,2024-07-02 09:09:37.876851,2024-07-02 09:25:45.148250,0 days 00:16:07.271399,leaky_relu,50.0,0.0005751214323123497,0.99,0.9038936456494084,,0.00022420814686771874,linear,0.7,8,50.0,1.0,32.0,False,True,False,0.0001506879941671769,59.0,True,True,0.7766999612496129,COMPLETE
301,301,13.3,2024-07-02 09:21:52.205812,2024-07-02 09:38:19.978794,0 days 00:16:27.772982,leaky_relu,50.0,1.7592939288481928e-06,0.95,0.9098216578965801,,6.566713725630956e-05,linear,0.7,8,20.0,1.0,512.0,False,True,False,0.00010314397884505854,55.0,True,True,0.4892369827106776,COMPLETE
302,302,11.608856800000002,2024-07-02 09:22:57.258607,2024-07-02 09:39:41.828976,0 days 00:16:44.570369,leaky_relu,10.0,1.0444500341059691e-05,0.99,0.9177577321625294,,2.545933905086022e-05,linear,0.9,8,20.0,1.0,512.0,False,True,False,5.106970799960546e-05,79.0,True,True,0.6894628895407156,COMPLETE
303,303,78.8980588,2024-07-02 09:25:45.195366,2024-07-02 09:42:25.618540,0 days 00:16:40.423174,leaky_relu,50.0,1.006150904433136e-05,0.99,0.9100432013373249,,0.0005734501749293539,linear,2.0,8,20.0,1.0,512.0,False,True,False,0.0001431426684941598,58.0,False,True,0.8202640081382321,COMPLETE
304,304,6.5926952,2024-07-02 09:38:20.027226,2024-07-02 09:52:33.518463,0 days 00:14:13.491237,tanh,5.0,6.213288656702826e-07,0.8,0.9752874881496548,,0.05426829035941273,constant,2.0,8,50.0,2.0,8.0,False,False,True,0.051520658682242586,85.0,True,False,0.6015923882713877,COMPLETE
305,305,270.384906,2024-07-02 09:39:41.876505,2024-07-02 09:57:38.376287,0 days 00:17:56.499782,leaky_relu,50.0,0.00719034925363448,0.95,0.9233368549667116,,0.027514681158258676,linear,0.5,8,20.0,1.0,512.0,False,False,False,0.007117417963846579,90.0,True,True,0.7769033922468029,COMPLETE
306,306,200.8271574,2024-07-02 09:42:25.659062,2024-07-02 09:58:13.764455,0 days 00:15:48.105393,tanh,50.0,1.907269847010822e-05,0.9,0.9299872803870018,,0.00020981274905083132,linear,2.0,8,20.0,2.0,128.0,False,False,False,0.014519082991037244,55.0,True,False,0.21936878244814034,COMPLETE
307,307,254.9075832,2024-07-02 09:52:33.562111,2024-07-02 10:07:28.675197,0 days 00:14:55.113086,relu,5.0,0.002498418193462245,0.9,0.9829886811645738,,0.0027872839807753427,constant,0.5,6,50.0,2.0,128.0,False,True,True,0.004748993431699588,4.0,True,False,0.00830924664899416,COMPLETE
308,308,4.8,2024-07-02 09:57:38.430522,2024-07-02 10:06:39.581894,0 days 00:09:01.151372,relu,100.0,0.006347879421542705,0.9,0.9506175122003928,,0.21372869426385682,linear,0.5,8,10.0,1.0,256.0,False,False,False,0.00022710456128032286,97.0,True,True,0.338663919390638,PRUNED
309,309,291.7865824,2024-07-02 09:58:13.825807,2024-07-02 10:11:26.925799,0 days 00:13:13.099992,tanh,50.0,0.002294566951069923,0.98,0.9898225761402476,,0.06954470669921474,constant,0.3,8,200.0,1.0,8.0,True,False,True,0.02797025663961963,30.0,True,False,0.8392517977121436,COMPLETE
310,310,220.37854299999998,2024-07-02 10:06:39.624056,2024-07-02 10:20:39.674001,0 days 00:14:00.049945,leaky_relu,5.0,0.09250934234532718,0.9,0.9830265092957071,,0.009508847857123963,constant,0.3,8,50.0,1.0,256.0,False,True,True,0.07765424772115262,3.0,True,False,0.03286418534141712,COMPLETE
311,311,16.94775,2024-07-02 10:07:28.737996,2024-07-02 10:26:03.329204,0 days 00:18:34.591208,tanh,50.0,0.0028249631695283885,0.9,0.9526984939067109,,0.011359594817316127,linear,0.5,8,10.0,1.0,16.0,False,False,False,0.0005042067178392549,65.0,True,True,0.5222898952474203,COMPLETE
312,312,249.98331079999997,2024-07-02 10:11:26.990237,2024-07-02 10:28:42.413353,0 days 00:17:15.423116,elu,10.0,2.0273205518421147e-05,0.92,0.9079544795670144,,0.0017593705008862447,linear,0.3,6,20.0,1.0,128.0,False,False,False,0.0004658929750974548,64.0,True,True,0.8017677013794792,COMPLETE
313,313,203.5099598,2024-07-02 10:20:39.739978,2024-07-02 10:35:27.810269,0 days 00:14:48.070291,tanh,50.0,1.5568920148670173e-06,0.98,0.9410776376782953,,0.017379208443988714,constant,0.3,8,200.0,1.0,8.0,True,False,True,0.016075458261615223,52.0,True,False,0.7742243874967394,COMPLETE
314,314,267.21572860000003,2024-07-02 10:26:03.391548,2024-07-02 10:41:44.106694,0 days 00:15:40.715146,tanh,100.0,5.454583507646623e-06,0.98,0.989397565091252,,0.05272943952255294,constant,0.9,6,50.0,1.0,8.0,False,True,False,0.006561364938601796,12.0,True,False,0.6758559316607846,COMPLETE
315,315,225.8181936,2024-07-02 10:28:42.480559,2024-07-02 10:44:14.227759,0 days 00:15:31.747200,tanh,50.0,0.00014527626100741705,0.98,0.9882013429237165,,0.02831235975833867,constant,0.3,8,50.0,1.0,8.0,False,True,False,0.012167792319227799,9.0,True,False,0.467524619063101,COMPLETE
316,316,13.232749799999999,2024-07-02 10:35:27.865855,2024-07-02 10:52:33.516831,0 days 00:17:05.650976,leaky_relu,50.0,0.00028265830186366897,0.99,0.9088696434593615,,0.00032627936509215834,linear,0.7,8,100.0,1.0,512.0,False,True,True,0.0001157200330245323,95.0,True,True,0.7202994858135037,COMPLETE
317,317,99.9198092,2024-07-02 10:41:44.168528,2024-07-02 10:58:44.145770,0 days 00:16:59.977242,relu,50.0,0.015902196680032517,0.95,0.9134409795354193,,0.0079452995938835,linear,0.5,6,20.0,1.0,64.0,False,False,False,0.014548922317967072,86.0,True,True,0.6049609837405405,COMPLETE
318,318,6.5107919999999995,2024-07-02 10:44:14.285110,2024-07-02 10:57:53.402924,0 days 00:13:39.117814,tanh,50.0,0.0022701268303756766,0.98,0.9935366689769354,,0.3247327576924613,constant,0.9,8,200.0,1.0,8.0,True,False,True,0.01724906685763921,22.0,True,False,0.9533595448604817,COMPLETE
319,319,2.8,2024-07-02 10:52:33.584883,2024-07-02 10:58:10.919014,0 days 00:05:37.334131,relu,50.0,0.03791631793369782,0.95,0.9053195219521459,,0.04018732022606117,linear,0.5,6,5.0,1.0,64.0,False,False,False,0.001791303581669768,99.0,True,True,0.24200370434675056,PRUNED
320,320,267.0129164,2024-07-02 10:57:53.453220,2024-07-02 11:11:46.141381,0 days 00:13:52.688161,elu,50.0,0.0011823944939247325,0.98,0.9767453306097647,,0.01663037200562873,constant,0.3,8,200.0,1.0,8.0,True,False,False,0.009747539935858876,29.0,True,False,0.5305051569706548,COMPLETE
321,321,5.3,2024-07-02 10:58:10.968216,2024-07-02 11:13:30.486707,0 days 00:15:19.518491,leaky_relu,50.0,0.0056386829227742805,1.0,0.9512351765139457,,0.27959166428104193,linear,2.0,8,100.0,2.0,512.0,False,True,False,0.003931945748550225,50.0,True,False,0.22154256504155542,COMPLETE
322,322,202.32521680000002,2024-07-02 10:58:44.213690,2024-07-02 11:18:10.068034,0 days 00:19:25.854344,elu,5.0,0.0007670308567974903,0.9,0.9446159346203166,,0.00021987143415331075,linear,2.0,8,20.0,2.0,32.0,False,False,False,0.0007182818955893627,82.0,True,True,0.3420253742329974,COMPLETE
323,323,12.4186998,2024-07-02 11:11:46.201555,2024-07-02 11:26:07.431389,0 days 00:14:21.229834,tanh,50.0,0.003873768387172954,0.92,0.9834786396410288,,0.003249443893391164,linear,0.3,8,200.0,1.0,8.0,True,False,True,0.055885153808808326,38.0,True,False,0.5900883280710696,COMPLETE
324,324,267.36341619999996,2024-07-02 11:13:30.539426,2024-07-02 11:29:31.804577,0 days 00:16:01.265151,tanh,50.0,0.007050458808814166,0.98,0.972543213680832,,0.014614065836829367,constant,0.3,8,200.0,2.0,64.0,True,False,True,0.04287467616252769,53.0,True,False,0.9649232784378454,COMPLETE
325,325,269.51635120000003,2024-07-02 11:18:10.137870,2024-07-02 11:33:24.439769,0 days 00:15:14.301899,tanh,10.0,0.00013969765491062396,0.98,0.9663702527706617,,0.008584007671107593,constant,1.0,8,200.0,2.0,8.0,True,False,True,0.035513571030688855,4.0,True,False,0.6817310049068791,COMPLETE
326,326,10.2491142,2024-07-02 11:26:07.490838,2024-07-02 11:43:58.047882,0 days 00:17:50.557044,elu,5.0,4.0947450036832353e-07,0.8,0.9823676391603275,,0.015469786629526987,linear,1.0,8,10.0,2.0,8.0,False,False,True,0.030509040775869294,32.0,True,False,0.69045618562105,COMPLETE
327,327,137.4780844,2024-07-02 11:29:31.865864,2024-07-02 11:47:17.843519,0 days 00:17:45.977655,leaky_relu,50.0,8.201550395460912e-05,0.99,0.9483303501033884,,0.00016447596853322836,linear,0.7,8,20.0,1.0,128.0,False,True,False,2.5885919455638583e-05,53.0,True,True,0.6858337242066079,COMPLETE
328,328,58.3053264,2024-07-02 11:33:24.486043,2024-07-02 11:40:33.873896,0 days 00:07:09.387853,relu,50.0,0.054139107310764524,0.9,0.9986272347363676,,0.7630223353098715,constant,0.3,8,200.0,1.0,8.0,True,False,True,0.06276417210989106,33.0,True,False,0.6827930931424196,PRUNED
329,329,210.45271580000002,2024-07-02 11:40:33.907740,2024-07-02 11:55:17.020011,0 days 00:14:43.112271,tanh,100.0,0.010201716912236427,0.8,0.9890679051964014,,0.00019308328900890612,constant,0.9,8,50.0,1.0,128.0,False,True,False,0.07385066049332298,15.0,True,False,0.12063185294309642,COMPLETE
330,330,10.5,2024-07-02 11:43:58.099472,2024-07-02 11:58:21.376249,0 days 00:14:23.276777,tanh,5.0,0.05901425297838728,0.8,0.9815961602394804,,0.0004186460034160369,constant,0.9,8,200.0,1.0,128.0,False,True,True,0.014994458674290214,27.0,True,False,0.2593355708448546,COMPLETE
331,331,12.711919599999998,2024-07-02 11:47:17.910724,2024-07-02 12:01:49.816731,0 days 00:14:31.906007,tanh,5.0,0.04030319240078765,0.99,0.9616619943334734,,0.0001619771222844389,constant,0.9,8,50.0,1.0,128.0,False,False,True,0.026505700894963586,5.0,True,False,0.4267134288565866,COMPLETE
332,332,59.377011800000005,2024-07-02 11:55:17.079062,2024-07-02 12:13:53.290887,0 days 00:18:36.211825,relu,100.0,0.009671537911395649,0.9,0.9842430785047028,,0.06690161311435838,linear,0.5,8,20.0,2.0,64.0,False,False,False,0.00041905805219573725,73.0,True,True,0.15385547732988938,COMPLETE
333,333,11.3,2024-07-02 11:58:21.432919,2024-07-02 12:13:01.396607,0 days 00:14:39.963688,elu,5.0,5.633502085918158e-07,0.95,0.9645904506112625,,0.0006287822371603606,constant,1.0,8,50.0,2.0,8.0,False,False,True,0.001102603988041524,57.0,True,False,0.686352295024985,COMPLETE
334,334,181.9651072,2024-07-02 12:01:49.877551,2024-07-02 12:16:38.038228,0 days 00:14:48.160677,elu,5.0,5.927536719774564e-07,0.8,0.9590564418983072,,0.01982925152994548,constant,0.3,8,50.0,2.0,16.0,False,False,True,0.06785335208968105,68.0,True,False,0.7841020779419383,COMPLETE
335,335,82.4684132,2024-07-02 12:13:01.449682,2024-07-02 12:30:20.069429,0 days 00:17:18.619747,tanh,50.0,1.978225211328656e-05,0.98,0.9782433722852555,,0.00031375801696123984,constant,0.3,8,10.0,1.0,512.0,True,False,True,0.02799580441671094,12.0,True,False,0.604858543286824,COMPLETE
336,336,188.0910324,2024-07-02 12:13:53.348870,2024-07-02 12:28:45.857970,0 days 00:14:52.509100,relu,50.0,1.821323827218963e-05,0.9,0.9761706984888129,,0.11380815339788507,constant,0.9,6,50.0,1.0,128.0,False,True,False,0.09977317923807473,5.0,True,False,0.7408598371111117,COMPLETE
337,337,215.81896700000001,2024-07-02 12:16:38.087452,2024-07-02 12:31:22.484691,0 days 00:14:44.397239,tanh,5.0,0.0006493054040687121,0.98,0.989204980976753,,0.007221887314006505,constant,0.9,8,50.0,1.0,32.0,False,True,False,0.03170234121329917,33.0,False,False,0.24941270481763092,COMPLETE
338,338,3.7,2024-07-02 12:28:45.921283,2024-07-02 12:45:25.415158,0 days 00:16:39.493875,relu,100.0,0.018103802826872944,0.9,0.9223985452010027,,0.26464808067892054,linear,0.3,8,20.0,1.0,256.0,False,False,False,0.0010638418686968873,45.0,True,True,0.18015622626576722,COMPLETE
339,339,3.8,2024-07-02 12:30:20.121012,2024-07-02 12:45:13.701334,0 days 00:14:53.580322,relu,100.0,0.03196402628221241,0.9,0.9676105988804273,,0.04590532716587303,linear,0.5,8,20.0,1.0,256.0,False,False,False,4.4522177798165146e-05,66.0,False,False,0.005640824538936162,COMPLETE
340,340,6.3,2024-07-02 12:31:22.550913,2024-07-02 12:47:22.230845,0 days 00:15:59.679932,leaky_relu,10.0,0.010669014300497978,1.0,0.9947768129551282,,0.12659105858293868,linear,0.7,8,100.0,3.0,512.0,False,False,False,0.009010408815826772,36.0,False,False,0.0782955509973261,COMPLETE
341,341,214.1348976,2024-07-02 12:45:13.762017,2024-07-02 13:01:16.513761,0 days 00:16:02.751744,tanh,50.0,6.820132889701931e-06,0.99,0.9363701453357836,,0.0004296365776817836,linear,0.7,8,200.0,1.0,512.0,False,True,False,0.00015366106694420027,76.0,True,True,0.6440621934801024,COMPLETE
342,342,271.70606399999997,2024-07-02 12:45:25.447011,2024-07-02 12:58:57.650086,0 days 00:13:32.203075,tanh,50.0,0.002127734126293045,0.99,0.978447529790137,,0.03378407318618539,constant,0.3,8,200.0,1.0,8.0,True,False,True,0.04847641743412222,14.0,True,False,0.5255879019970358,COMPLETE
343,343,167.8002676,2024-07-02 12:47:22.280155,2024-07-02 13:04:41.943890,0 days 00:17:19.663735,elu,10.0,3.655260912177201e-05,0.92,0.9415893829451312,,0.0015625492689419892,linear,0.7,8,20.0,1.0,16.0,False,False,False,0.0037889795833632705,57.0,True,True,0.9156192652976258,COMPLETE
344,344,53.5620592,2024-07-02 12:58:57.715058,2024-07-02 13:13:51.947302,0 days 00:14:54.232244,tanh,100.0,0.0005476133748535042,0.98,0.9957996008341621,,0.3415575686029866,constant,0.9,6,20.0,1.0,512.0,False,True,False,0.086587800184002,39.0,True,False,0.9617612468094232,COMPLETE
345,345,213.827201,2024-07-02 13:01:16.573503,2024-07-02 13:17:34.866083,0 days 00:16:18.292580,tanh,10.0,3.2777033278277874e-05,0.98,0.9978362328581163,,0.04363184266470912,constant,0.3,8,200.0,3.0,8.0,False,False,True,0.020232588491174097,22.0,True,True,0.5091973154160275,COMPLETE
346,346,13.1,2024-07-02 13:04:41.999276,2024-07-02 13:21:44.618256,0 days 00:17:02.618980,elu,10.0,3.0354417423696634e-07,0.92,0.9162092765002036,,0.00020218800048601114,linear,0.7,8,20.0,1.0,512.0,False,False,True,0.001874509055521939,95.0,True,True,0.9766977044041572,COMPLETE
347,347,8.2,2024-07-02 13:13:52.023189,2024-07-02 13:32:14.896639,0 days 00:18:22.873450,tanh,5.0,0.011825966951409077,0.9,0.9653272397608567,,0.003859194586657829,constant,0.5,8,10.0,1.0,128.0,False,True,True,0.07550374759183218,18.0,True,True,0.143597417692148,COMPLETE
348,348,164.36258500000002,2024-07-02 13:17:34.924895,2024-07-02 13:31:21.962402,0 days 00:13:47.037507,elu,5.0,0.06504925981549789,0.9,0.9916829910875476,,0.0034039364338823955,constant,0.3,8,50.0,1.0,128.0,False,False,True,0.0172182099912885,10.0,True,False,0.1582514928351596,COMPLETE
349,349,201.6487376,2024-07-02 13:21:44.661912,2024-07-02 13:37:08.469393,0 days 00:15:23.807481,tanh,100.0,0.018921482653059117,1.0,0.9713641737601708,,0.00013474834799070918,constant,5.0,8,20.0,1.0,128.0,False,True,True,0.0746019433872149,5.0,False,False,0.01888560377908044,COMPLETE
350,350,253.4714046,2024-07-02 13:31:22.022133,2024-07-02 13:46:28.493075,0 days 00:15:06.470942,leaky_relu,5.0,0.04658168233668243,0.98,0.9987835270060029,,0.07630759841041111,constant,0.9,8,50.0,1.0,128.0,False,True,False,0.007963603453028462,13.0,True,False,0.3540249763003871,COMPLETE
351,351,7.1,2024-07-02 13:32:14.961540,2024-07-02 13:48:48.228512,0 days 00:16:33.266972,leaky_relu,10.0,0.025997017230023123,0.8,0.9966012837217706,,0.01596193644460852,constant,2.0,8,100.0,2.0,512.0,False,True,False,0.001525819763605485,37.0,True,False,0.2550048684233252,COMPLETE
352,352,262.49517360000004,2024-07-02 13:37:08.533581,2024-07-02 13:51:42.111700,0 days 00:14:33.578119,elu,100.0,8.392705126830296e-08,0.8,0.9588863864059237,,0.0006858030402157269,constant,0.9,8,200.0,1.0,32.0,False,False,True,0.03924259480035048,51.0,True,False,0.5301717502267009,COMPLETE
353,353,263.3428032,2024-07-02 13:46:28.550716,2024-07-02 14:00:45.458288,0 days 00:14:16.907572,elu,10.0,0.03176564765737091,0.98,0.9892598283139356,,0.11995967822743897,linear,0.9,8,50.0,2.0,16.0,False,False,True,0.057397349620691915,18.0,True,False,0.49245428491732923,COMPLETE
354,354,71.711498,2024-07-02 13:48:48.287532,2024-07-02 14:09:13.742105,0 days 00:20:25.454573,tanh,50.0,0.00016072142034573048,0.99,0.9280348226758162,,0.0016703884464083017,linear,0.7,8,10.0,2.0,128.0,False,False,False,0.00014540422654915025,76.0,True,True,0.7843218834069143,COMPLETE
355,355,233.9954972,2024-07-02 13:51:42.163313,2024-07-02 14:07:34.906177,0 days 00:15:52.742864,tanh,100.0,0.000210980729198375,1.0,0.9896491697078935,,0.003008142738097309,constant,0.9,8,50.0,2.0,8.0,False,False,True,0.009665822217694584,6.0,True,True,0.30699173810654057,COMPLETE
356,356,274.4543648,2024-07-02 14:00:45.510217,2024-07-02 14:15:13.935099,0 days 00:14:28.424882,leaky_relu,10.0,0.06845914382028677,0.8,0.9718374478482189,,0.002494209726783965,constant,0.9,8,50.0,2.0,128.0,False,True,True,0.032675028602623626,25.0,True,False,0.33832887676231527,COMPLETE
357,357,105.7550548,2024-07-02 14:07:34.960199,2024-07-02 14:25:46.051956,0 days 00:18:11.091757,leaky_relu,50.0,1.477769977782667e-06,0.99,0.9114943603945327,,0.0005076817303471003,linear,0.7,8,20.0,1.0,512.0,False,True,False,9.082791113750163e-05,91.0,True,True,0.9176080034522762,COMPLETE
358,358,52.9754004,2024-07-02 14:09:13.808381,2024-07-02 14:24:10.254617,0 days 00:14:56.446236,tanh,5.0,0.020058148637471917,1.0,0.9686085725872008,,0.09623138526121833,constant,5.0,6,50.0,1.0,128.0,False,True,True,0.09116774380912117,35.0,False,False,0.02988528007935759,COMPLETE
359,359,209.6005038,2024-07-02 14:15:14.003105,2024-07-02 14:29:33.963291,0 days 00:14:19.960186,leaky_relu,100.0,6.52126014756035e-05,0.99,0.9834435937286027,,0.07737855049087816,constant,0.9,6,50.0,1.0,128.0,False,True,False,0.03351742529949324,8.0,True,False,0.9055168661823397,COMPLETE
360,360,12.454474399999999,2024-07-02 14:24:10.344022,2024-07-02 14:41:00.821216,0 days 00:16:50.477194,elu,50.0,5.039452765814801e-06,1.0,0.9653931116419541,,6.686584283572042e-05,constant,0.9,8,50.0,3.0,8.0,True,False,True,0.01091061144480141,75.0,True,True,0.6192816836090461,COMPLETE
361,361,97.2393572,2024-07-02 14:25:46.104726,2024-07-02 14:41:49.755908,0 days 00:16:03.651182,tanh,10.0,0.025986081634399492,0.98,0.9622689443012387,,0.022255979547664496,constant,0.3,8,200.0,2.0,8.0,True,False,True,0.0197145213269331,9.0,False,True,0.6232596342111995,COMPLETE
362,362,15.4657942,2024-07-02 14:29:34.019556,2024-07-02 14:44:56.197262,0 days 00:15:22.177706,tanh,100.0,0.0003097938732430882,0.95,0.986738405855555,,0.435107584841774,constant,0.9,6,50.0,2.0,128.0,False,True,True,0.010801437427120166,16.0,True,False,0.7324853439875051,COMPLETE
363,363,199.8983976,2024-07-02 14:41:00.881724,2024-07-02 14:57:38.485941,0 days 00:16:37.604217,relu,5.0,0.00431677802155746,0.92,0.9020126329069429,,0.10664415472315444,linear,0.5,6,20.0,1.0,256.0,False,False,False,0.043049788278852474,91.0,True,True,0.5709543743848859,COMPLETE
364,364,67.88006879999999,2024-07-02 14:41:49.817935,2024-07-02 14:58:33.407317,0 days 00:16:43.589382,tanh,10.0,0.005108539348585295,0.92,0.9268453445604578,,0.0008901929195202531,linear,0.7,8,20.0,1.0,512.0,False,True,False,0.0007566250939563903,87.0,True,True,0.7176552065701831,COMPLETE
365,365,275.7108858,2024-07-02 14:44:56.247473,2024-07-02 14:58:33.640303,0 days 00:13:37.392830,tanh,5.0,0.032698863548252376,0.98,0.9946636740404095,,0.0034537540991586195,constant,0.3,8,50.0,1.0,128.0,False,True,True,0.04582177865818655,2.0,True,False,0.01236241152230525,COMPLETE
366,366,10.5,2024-07-02 14:57:38.539061,2024-07-02 15:13:58.976721,0 days 00:16:20.437660,leaky_relu,10.0,0.0016242782244120157,0.8,0.9538284523620928,,0.004964035770362088,constant,0.9,8,50.0,3.0,128.0,False,True,True,0.0040615855031498425,8.0,True,False,0.4284631087205223,COMPLETE
367,367,209.6030106,2024-07-02 14:58:33.469405,2024-07-02 15:13:56.597986,0 days 00:15:23.128581,leaky_relu,10.0,0.026317557934575884,0.98,0.9700245077754709,,0.03246178694189309,linear,0.9,8,100.0,2.0,512.0,False,True,False,0.0016355368030485239,55.0,True,False,0.5221042337016801,COMPLETE
368,368,218.8755984,2024-07-02 14:58:33.670768,2024-07-02 15:13:57.713573,0 days 00:15:24.042805,leaky_relu,10.0,0.010758709421152129,0.8,0.9947125306552272,,0.0011631139105076627,constant,0.9,8,50.0,2.0,128.0,False,True,True,0.01520744159661985,24.0,True,False,0.7540527490847511,COMPLETE
369,369,7.2,2024-07-02 15:13:56.656136,2024-07-02 15:31:06.271550,0 days 00:17:09.615414,leaky_relu,10.0,0.0009628411708790434,0.98,0.9713496670488855,,0.0009022799180222336,constant,0.9,8,10.0,2.0,16.0,False,True,True,0.03608922286127394,32.0,True,False,0.19301504338982614,COMPLETE
370,370,278.2823918,2024-07-02 15:13:57.746625,2024-07-02 15:29:12.497097,0 days 00:15:14.750472,tanh,5.0,0.007955368793867655,0.98,0.9819809002786435,,0.08026475276690764,constant,0.3,8,50.0,2.0,8.0,False,True,True,0.021121370908721907,13.0,True,False,0.1348060861445257,COMPLETE
371,371,12.937947,2024-07-02 15:13:58.998169,2024-07-02 15:30:00.657218,0 days 00:16:01.659049,elu,5.0,0.017534726762049917,0.98,0.9920511870765183,,0.002693346461874728,constant,0.3,8,50.0,2.0,128.0,False,True,True,0.0627811119097521,6.0,True,False,0.04465118751423515,COMPLETE
372,372,272.2792194,2024-07-02 15:29:12.542135,2024-07-02 15:43:56.177350,0 days 00:14:43.635215,tanh,5.0,0.03948797848980963,0.98,0.9581690369820447,,0.007385146016905163,constant,0.3,8,50.0,2.0,8.0,False,True,True,0.007231473541941136,19.0,True,False,0.13986577405185993,COMPLETE
373,373,165.69631859999998,2024-07-02 15:30:00.723976,2024-07-02 15:44:38.500939,0 days 00:14:37.776963,tanh,5.0,0.06724991740631826,0.92,0.9667764755686228,,0.007976981795730621,constant,0.3,8,50.0,1.0,128.0,False,True,False,0.0842562669960222,6.0,True,False,0.17418474005910276,COMPLETE
374,374,233.80713339999997,2024-07-02 15:31:06.327745,2024-07-02 15:49:50.765754,0 days 00:18:44.438009,tanh,5.0,0.026499943823175543,1.0,0.9979869536578672,,0.004468335541420453,constant,0.9,8,50.0,2.0,128.0,False,True,True,0.001618490172720627,5.0,True,True,0.5698601692210741,COMPLETE
