,number,value,datetime_start,datetime_complete,duration,params_activation_fn,params_clip_obs,params_ent_coef,params_gae_lambda,params_gamma,params_initialization_strategy,params_learning_rate,params_lr_schedule,params_max_grad_norm,params_max_ingredients,params_n_steps,params_net_arch_depth,params_net_arch_width,params_norm_reward,params_normalize_advantage,params_ortho_init,params_rms_prop_eps,params_sde_sample_freq,params_use_rms_prop,params_use_sde,params_vf_coef,state
0,0,,2024-06-29 17:22:35.268829,2024-06-29 17:22:47.369092,0 days 00:00:12.100263,leaky_relu,100.0,0.04427740448821554,0.8,0.9639923685146876,perfect,0.0021314754552138435,constant,2.0,6,10.0,3.0,256.0,False,True,False,0.09139730262341357,60.0,True,True,0.5530757657692436,FAIL
1,1,,2024-06-29 17:26:52.040366,2024-06-29 17:26:57.290954,0 days 00:00:05.250588,,,,,,probabilistic,,,,8,,,,,,,,,,,,FAIL
2,2,,2024-06-29 17:30:58.456984,2024-06-29 17:34:21.312479,0 days 00:03:22.855495,relu,10.0,2.1479986840116536e-05,0.99,0.9315537133354442,probabilistic,1.3332454852191948e-05,linear,0.3,6,100.0,1.0,512.0,True,True,False,0.00169869522187607,86.0,False,True,0.6260067030389312,FAIL
3,3,114.6338634,2024-06-29 17:35:25.117696,2024-06-29 20:50:30.259535,0 days 03:15:05.141839,elu,50.0,0.00015714856393364733,0.92,0.9171037753854044,perfect,0.0011295624440546442,linear,0.9,8,50.0,1.0,16.0,True,True,True,0.007348267594708528,74.0,False,False,0.9139568835283367,COMPLETE
4,4,165.071044,2024-06-29 17:35:25.122746,2024-06-29 22:25:52.255967,0 days 04:50:27.133221,leaky_relu,10.0,0.0007006554453176656,0.98,0.9170155194615327,perfect,1.8243955763301413e-05,linear,0.7,6,5.0,1.0,64.0,True,False,False,6.990918054267701e-05,38.0,False,True,0.6252742027899203,COMPLETE
5,5,148.330569,2024-06-29 17:35:25.140832,2024-06-29 21:08:28.278109,0 days 03:33:03.137277,leaky_relu,100.0,1.1678404692666027e-08,0.99,0.9164513016932211,zero,0.20368910467111329,linear,0.9,8,200.0,1.0,8.0,True,True,False,0.007357876589166011,56.0,False,True,0.7706436339348637,COMPLETE
6,6,5.7,2024-06-29 20:50:30.315990,2024-06-29 23:47:44.201466,0 days 02:57:13.885476,tanh,100.0,1.4779884698203951e-05,0.99,0.9067929492070746,zero,0.026060878720960214,linear,0.9,8,10.0,3.0,256.0,False,False,False,0.0010666665972896155,53.0,False,True,0.1819753596837823,COMPLETE
7,7,186.7781304,2024-06-29 21:08:28.329111,2024-06-29 23:43:12.051568,0 days 02:34:43.722457,leaky_relu,5.0,2.183958870242607e-08,1.0,0.9106273748464156,zero,8.097351563887353e-05,linear,2.0,6,5.0,1.0,32.0,True,False,False,0.00046232794967340866,80.0,True,True,0.5500033474912425,COMPLETE
8,8,,2024-06-29 22:25:52.309151,2024-06-29 22:26:03.724144,0 days 00:00:11.414993,,,,,,probabilistic,,,,8,,,,,,,,,,,,FAIL
9,9,10.7,2024-07-01 07:41:50.265872,2024-07-01 08:00:52.267779,0 days 00:19:02.001907,tanh,5.0,1.4049730435351543e-07,0.92,0.9043270107642105,,1.542603710062169e-05,constant,1.0,6,50.0,3.0,512.0,False,True,True,0.00025511276091739327,11.0,True,True,0.7711080987957022,COMPLETE
10,10,119.91165120000001,2024-07-01 07:41:50.270450,2024-07-01 07:55:07.079408,0 days 00:13:16.808958,tanh,5.0,0.0017655295917062752,0.9,0.9150934420749421,,0.000384722967701249,constant,5.0,6,50.0,1.0,128.0,False,False,False,0.0030993492889613687,83.0,True,False,0.7820116274887461,COMPLETE
11,11,9.683793,2024-07-01 07:41:50.286641,2024-07-01 07:56:06.311416,0 days 00:14:16.024775,elu,10.0,6.561342861542106e-06,1.0,0.9599926859182814,,0.09801921820662297,constant,1.0,6,50.0,2.0,256.0,True,False,True,0.01309876272188367,39.0,False,False,0.3171104103239274,COMPLETE
12,12,165.6481362,2024-07-01 07:55:07.142655,2024-07-01 08:08:46.469315,0 days 00:13:39.326660,leaky_relu,10.0,0.07814053889319286,1.0,0.999194623807914,,0.12877467135135495,constant,2.0,8,100.0,1.0,8.0,False,True,False,0.016509529578685532,41.0,True,False,0.4712206777907081,COMPLETE
13,13,3.9,2024-07-01 07:56:06.370128,2024-07-01 08:10:25.636065,0 days 00:14:19.265937,relu,100.0,4.171750391059985e-07,0.9,0.9719529515879413,,0.28545586228788833,constant,0.9,6,100.0,2.0,128.0,True,False,False,0.002260319481361279,12.0,True,False,0.8006776089570067,COMPLETE
14,14,51.43333299999999,2024-07-01 08:00:52.337652,2024-07-01 08:20:12.179359,0 days 00:19:19.841707,relu,50.0,0.038845197668645526,0.95,0.9790761907769399,,0.00045152746402660253,linear,0.7,6,5.0,1.0,256.0,False,True,True,0.00024290603752665543,85.0,False,False,0.18142239458759768,COMPLETE
15,15,45.5402352,2024-07-01 08:08:46.535681,2024-07-01 08:22:27.964758,0 days 00:13:41.429077,elu,100.0,0.02951763897996487,0.92,0.9848227952348889,,0.037402685400346324,linear,0.5,8,20.0,1.0,16.0,True,False,True,0.013753142026542192,40.0,True,False,0.549346674235438,COMPLETE
16,16,161.88339100000002,2024-07-01 08:10:25.690067,2024-07-01 08:28:04.903013,0 days 00:17:39.212946,leaky_relu,10.0,2.962469858797327e-08,0.95,0.9030383183779603,,5.848362146790302e-05,linear,0.9,6,10.0,1.0,32.0,False,False,False,1.218393337647011e-05,75.0,True,True,0.39735404083664616,COMPLETE
17,17,274.4410094,2024-07-01 08:20:12.239709,2024-07-01 08:35:54.211734,0 days 00:15:41.972025,leaky_relu,10.0,0.04149621143144636,1.0,0.998095006367275,,0.02311489743305316,linear,2.0,8,100.0,2.0,512.0,False,True,False,0.00360116053946449,43.0,True,False,0.2639844846021274,COMPLETE
18,18,199.47274999999996,2024-07-01 08:22:28.021706,2024-07-01 08:37:02.999894,0 days 00:14:34.978188,tanh,10.0,0.011527077583488655,0.98,0.9793643810545002,,0.007688087354282422,constant,2.0,8,50.0,1.0,256.0,False,True,False,0.005329838524076493,41.0,True,False,0.5158870949390766,COMPLETE
19,19,6.0473732,2024-07-01 08:28:04.970186,2024-07-01 08:42:26.277275,0 days 00:14:21.307089,leaky_relu,10.0,0.0028102032901173597,0.95,0.9949153887190758,,0.3683802846075209,constant,2.0,8,100.0,2.0,8.0,False,True,False,0.005079793677310486,36.0,True,False,0.5226999922195465,COMPLETE
20,20,250.61015740000002,2024-07-01 08:35:54.264375,2024-07-01 08:52:11.093692,0 days 00:16:16.829317,leaky_relu,5.0,8.21962621835629e-06,0.8,0.9026898633551466,,4.174581273559385e-05,linear,2.0,6,20.0,1.0,32.0,True,False,False,0.0012127659149340708,99.0,True,True,0.6362254594954213,COMPLETE
21,21,6.7,2024-07-01 08:37:03.048595,2024-07-01 08:55:23.963416,0 days 00:18:20.914821,leaky_relu,10.0,0.0033964861641326127,0.9,0.967683489391481,,0.2431343328534422,linear,0.5,8,10.0,2.0,512.0,False,True,False,0.015086480510295519,52.0,True,False,0.08035358593674136,COMPLETE
22,22,280.284579,2024-07-01 08:42:26.316313,2024-07-01 08:55:56.262512,0 days 00:13:29.946199,tanh,5.0,0.0007736272682085365,0.98,0.9996036103348427,,0.033693177423174916,constant,0.9,8,50.0,1.0,128.0,False,True,False,0.011965576321145237,7.0,True,False,0.3979308458478025,COMPLETE
23,23,10.1,2024-07-01 08:52:11.147266,2024-07-01 09:08:19.476049,0 days 00:16:08.328783,leaky_relu,5.0,1.4733311550864392e-08,0.8,0.9238302175427591,,2.4680084325540126e-05,linear,0.7,6,20.0,1.0,8.0,True,True,True,0.0013893898448560996,79.0,False,True,0.7200559937282897,COMPLETE
24,24,234.14328260000002,2024-07-01 08:55:24.010046,2024-07-01 09:11:37.640589,0 days 00:16:13.630543,elu,50.0,4.803290991366127e-06,0.8,0.9123413978409366,,6.140634666639962e-05,linear,2.0,6,20.0,1.0,512.0,True,False,False,5.142982609021944e-05,95.0,True,True,0.7485842012052235,COMPLETE
25,25,235.16821440000004,2024-07-01 08:55:56.317995,2024-07-01 09:09:58.361869,0 days 00:14:02.043874,tanh,5.0,0.04105760389204412,0.8,0.9996849531408848,,0.016285833620222925,constant,0.9,6,20.0,1.0,128.0,False,True,False,0.04838847422122517,26.0,True,False,0.5007471407843036,COMPLETE
26,26,4.9,2024-07-01 09:08:19.524322,2024-07-01 09:28:20.981730,0 days 00:20:01.457408,tanh,5.0,0.00868341286697043,0.98,0.9682056284937034,,0.02264105023313302,linear,0.3,8,5.0,2.0,128.0,False,True,False,0.0003735638325715319,20.0,True,False,0.23338185596813504,COMPLETE
27,27,265.1168212,2024-07-01 09:09:58.418576,2024-07-01 09:25:17.865221,0 days 00:15:19.446645,leaky_relu,5.0,0.0030870852637125646,0.98,0.9362762328342946,,0.00018834503579370508,linear,2.0,6,20.0,1.0,32.0,True,False,False,0.00017892262901159827,82.0,True,True,0.6373024054060213,COMPLETE
28,28,75.1625396,2024-07-01 09:11:37.695730,2024-07-01 09:24:54.117477,0 days 00:13:16.421747,tanh,5.0,2.2764430019085927e-06,0.92,0.990338741901534,,0.0016793167994468574,constant,0.5,8,50.0,1.0,128.0,False,True,False,0.05268250409221904,1.0,True,False,0.33500626402406414,COMPLETE
29,29,56.410708,2024-07-01 09:24:54.161058,2024-07-01 09:40:12.956493,0 days 00:15:18.795435,leaky_relu,50.0,3.660428200598529e-06,0.8,0.913784684479303,,4.461407581542401e-05,linear,5.0,6,20.0,1.0,32.0,False,False,False,0.007817039112043265,63.0,True,True,0.6409141177998244,COMPLETE
30,30,270.390985,2024-07-01 09:25:17.915152,2024-07-01 09:41:39.500126,0 days 00:16:21.584974,leaky_relu,5.0,0.0012074680039781936,0.98,0.9585169609256008,,0.007292600310901481,linear,2.0,6,20.0,1.0,256.0,True,False,False,0.00034820597441306166,65.0,True,True,0.41825264618358093,COMPLETE
31,31,5.0,2024-07-01 09:28:21.037723,2024-07-01 09:42:47.702709,0 days 00:14:26.664986,tanh,10.0,0.006069498093849696,0.99,0.9742582982168833,,0.004328876837830786,linear,2.0,8,100.0,2.0,512.0,False,False,False,0.003504830462192962,53.0,True,False,0.2610156385109274,COMPLETE
32,32,9.1,2024-07-01 09:40:13.020985,2024-07-01 09:54:46.370252,0 days 00:14:33.349267,tanh,5.0,2.3128943301107767e-05,0.98,0.9827367440229952,,0.06838114422869822,linear,0.9,8,50.0,1.0,128.0,True,True,True,0.005347290570854235,3.0,False,False,0.2730310687914202,COMPLETE
33,33,177.01214019999998,2024-07-01 09:41:39.554646,2024-07-01 09:57:13.904469,0 days 00:15:34.349823,leaky_relu,10.0,0.0499958002234585,0.8,0.9798530052801263,,0.01087376208154711,linear,2.0,6,50.0,2.0,32.0,False,True,False,0.0025713218619201226,52.0,True,False,0.32793880764737104,COMPLETE
34,34,217.0802468,2024-07-01 09:42:47.754939,2024-07-01 09:58:27.033261,0 days 00:15:39.278322,leaky_relu,100.0,0.0022295640853213627,1.0,0.9989320025739286,,0.0023883194051812855,linear,0.7,8,100.0,2.0,512.0,False,True,False,0.003337543392260349,59.0,True,False,0.328264667104018,COMPLETE
35,35,239.57925740000002,2024-07-01 09:54:46.432545,2024-07-01 10:09:54.659066,0 days 00:15:08.226521,elu,50.0,0.005028401825478403,1.0,0.9908241697648328,,0.0019022057358024842,linear,0.9,8,100.0,2.0,512.0,False,True,False,0.004646052049383294,40.0,True,False,0.29605363726719647,COMPLETE
36,36,268.4939752,2024-07-01 09:57:13.968087,2024-07-01 10:12:22.368061,0 days 00:15:08.399974,tanh,100.0,0.00014543244271760062,0.98,0.9843475012161969,,0.003866475211929124,constant,0.9,8,50.0,2.0,32.0,False,False,True,0.017319310172875572,2.0,True,False,0.40110123753166993,COMPLETE
37,37,242.59885119999998,2024-07-01 09:58:27.095727,2024-07-01 10:14:04.223990,0 days 00:15:37.128263,leaky_relu,10.0,0.00034494907505249937,0.98,0.9630330388670739,,0.0010650390351500166,linear,2.0,6,50.0,1.0,256.0,True,False,False,0.0015725510674947226,56.0,True,True,0.1925758048259192,COMPLETE
38,38,13.9059554,2024-07-01 10:09:54.713495,2024-07-01 10:24:38.461881,0 days 00:14:43.748386,leaky_relu,5.0,0.005509664440201234,0.9,0.961012871799458,,0.03618877922986362,linear,2.0,6,200.0,1.0,256.0,True,False,False,5.376562540243097e-05,59.0,True,True,0.22075915044041505,COMPLETE
39,39,274.7216606,2024-07-01 10:12:22.422958,2024-07-01 10:25:51.446849,0 days 00:13:29.023891,elu,100.0,0.00012143633857597885,0.98,0.9872649699871736,,0.0017385220362676065,constant,0.9,8,50.0,2.0,8.0,False,False,True,0.021482275061442957,7.0,True,False,0.33617195076970985,COMPLETE
40,40,69.9876286,2024-07-01 10:14:04.281343,2024-07-01 10:34:07.423708,0 days 00:20:03.142365,elu,100.0,0.0003449028265727022,0.98,0.9677788284710069,,5.7813284337744685e-05,linear,0.9,8,5.0,2.0,32.0,False,True,True,0.022448059932867588,14.0,True,False,0.3305012764694823,COMPLETE
41,41,15.6357656,2024-07-01 10:24:38.521593,2024-07-01 10:40:59.288213,0 days 00:16:20.766620,tanh,100.0,6.060111815545026e-06,0.98,0.9806007205072652,,0.0003272337879101113,constant,0.3,6,10.0,2.0,32.0,False,False,True,0.01406832580567515,14.0,True,False,0.4073550929685505,COMPLETE
42,42,141.82691559999998,2024-07-01 10:25:51.497976,2024-07-01 10:39:42.974607,0 days 00:13:51.476631,elu,100.0,5.075636102964776e-05,0.98,0.975454943166519,,0.0004888531296420203,constant,0.5,8,50.0,3.0,8.0,True,False,False,0.00942887012981204,9.0,True,False,0.7210127916785045,COMPLETE
43,43,5.2,2024-07-01 10:34:07.467599,2024-07-01 10:55:03.271462,0 days 00:20:55.803863,leaky_relu,5.0,0.00022600195416389474,0.98,0.9986952735316407,,0.08124720928739718,constant,0.9,8,5.0,2.0,128.0,False,True,True,0.06603796328770956,8.0,True,False,0.3365949086349692,COMPLETE
44,44,6.1,2024-07-01 10:39:43.020320,2024-07-01 10:53:18.715198,0 days 00:13:35.694878,tanh,5.0,0.0005870677477742708,0.98,0.9769161784803141,,0.2815912365516888,constant,0.9,8,50.0,2.0,16.0,False,True,False,0.022373295889672948,8.0,True,False,0.5496564847809677,COMPLETE
45,45,270.384906,2024-07-01 10:40:59.335784,2024-07-01 10:57:13.687142,0 days 00:16:14.351358,tanh,50.0,0.0018357768861263833,0.98,0.9546839045494095,,0.002982575393434475,linear,0.5,6,20.0,1.0,256.0,False,False,False,0.0004828255979220379,72.0,True,True,0.5124018096655767,COMPLETE
46,46,269.03128200000003,2024-07-01 10:53:18.757038,2024-07-01 11:08:53.812734,0 days 00:15:35.055696,elu,100.0,0.00011017848326759197,0.98,0.9869621821602146,,0.00026653826333663524,constant,0.9,8,50.0,2.0,8.0,False,True,True,0.009274566794334102,29.0,False,True,0.37371943207431607,COMPLETE
47,47,271.67802420000004,2024-07-01 10:55:03.321913,2024-07-01 11:10:22.813623,0 days 00:15:19.491710,relu,100.0,3.217224892104862e-05,0.98,0.9771709650649637,,0.020377698810472033,constant,0.9,8,50.0,2.0,256.0,False,False,True,0.04480406492271391,12.0,True,False,0.39044797292750205,COMPLETE
48,48,8.0,2024-07-01 10:57:13.737448,2024-07-01 11:12:44.746391,0 days 00:15:31.008943,relu,10.0,0.014801270511777669,1.0,0.98859427685586,,0.004740870645611188,linear,2.0,8,50.0,2.0,512.0,False,True,True,0.009976925896466003,31.0,False,False,0.3132684585392985,COMPLETE
49,49,215.3327292,2024-07-01 11:08:53.865645,2024-07-01 11:28:13.928325,0 days 00:19:20.062680,tanh,50.0,0.0014867703628976868,0.98,0.9738421750450651,,0.007104161022234038,linear,0.9,8,20.0,2.0,256.0,False,False,False,0.0036324406850991183,66.0,True,True,0.9244457658251838,COMPLETE
50,50,56.199077599999995,2024-07-01 11:10:22.859148,2024-07-01 11:24:10.123365,0 days 00:13:47.264217,relu,10.0,1.3439016421182136e-05,0.98,0.9693796699759237,,0.013544173177936077,constant,2.0,8,50.0,1.0,256.0,True,False,True,0.003291745729422669,9.0,True,False,0.3590413012856276,COMPLETE
51,51,8.86884,2024-07-01 11:12:44.790429,2024-07-01 11:28:14.157095,0 days 00:15:29.366666,elu,100.0,0.00095706507820139,0.9,0.9626521651595041,,0.022991577496848232,constant,5.0,6,50.0,2.0,256.0,False,False,True,0.0902611625604276,35.0,True,False,0.36610730780935163,COMPLETE
52,52,12.8,2024-07-01 11:24:10.166954,2024-07-01 11:38:27.112087,0 days 00:14:16.945133,elu,100.0,6.926218759549984e-07,0.95,0.9507110809147992,,0.00013758835943977667,constant,0.3,8,50.0,2.0,8.0,False,False,True,0.0009194631888492232,18.0,True,False,0.3482010201177716,COMPLETE
53,53,5.2,2024-07-01 11:28:13.980378,2024-07-01 11:43:15.152954,0 days 00:15:01.172576,leaky_relu,5.0,0.00043512576773588785,0.98,0.9595282740628023,,0.06689290121387292,linear,2.0,6,20.0,1.0,256.0,True,False,False,0.0009107746490519882,62.0,True,False,0.6245534442572755,COMPLETE
54,54,10.6,2024-07-01 11:28:14.185873,2024-07-01 11:49:43.940171,0 days 00:21:29.754298,tanh,100.0,0.015606165802196724,0.98,0.9850948642471696,,0.010516064437440322,constant,0.9,8,5.0,1.0,128.0,False,True,False,0.00878491226594559,10.0,False,False,0.3243017893709718,COMPLETE
55,55,53.828123000000005,2024-07-01 11:38:27.172031,2024-07-01 11:52:41.900757,0 days 00:14:14.728726,elu,100.0,0.002990168963501377,0.98,0.9577671359202817,,0.016812258411211475,linear,0.9,6,100.0,2.0,8.0,False,False,True,0.0013429123736066436,12.0,True,False,0.2958313619180386,COMPLETE
56,56,187.2736026,2024-07-01 11:43:15.207780,2024-07-01 11:57:36.187053,0 days 00:14:20.979273,relu,100.0,0.00043244536026724995,0.98,0.9413575331698466,,0.0015818018798587463,constant,5.0,8,50.0,2.0,16.0,False,True,True,0.0060405060316297806,9.0,True,False,0.17961018114952673,COMPLETE
57,57,236.7532878,2024-07-01 11:49:43.991362,2024-07-01 12:04:55.139315,0 days 00:15:11.147953,relu,100.0,3.0479895544269396e-06,0.92,0.9648964446442365,,0.006985804352606256,constant,0.9,8,50.0,2.0,256.0,False,True,True,0.0454571297554844,21.0,True,False,0.29778105074377537,COMPLETE
58,58,271.9915772,2024-07-01 11:52:41.949755,2024-07-01 12:09:04.778275,0 days 00:16:22.828520,tanh,50.0,0.011854980370690018,0.95,0.9558743854200938,,0.0035924643198957276,linear,0.5,6,20.0,1.0,64.0,False,False,False,0.00028649334826856055,77.0,True,True,0.3854841820515975,COMPLETE
59,59,94.1511802,2024-07-01 11:57:36.235187,2024-07-01 12:14:01.653012,0 days 00:16:25.417825,elu,50.0,0.0026028491057355015,0.98,0.976239441443586,,0.011562324209286297,linear,0.5,6,20.0,1.0,256.0,False,False,False,5.7749550284123965e-05,89.0,False,True,0.5927708437312824,COMPLETE
60,60,213.51870739999998,2024-07-01 12:04:55.186589,2024-07-01 12:20:19.762683,0 days 00:15:24.576094,tanh,10.0,1.946110987831214e-05,0.9,0.9450216793365309,,0.001140293945879781,linear,0.5,6,20.0,1.0,16.0,False,False,False,0.0033526669154125177,91.0,True,True,0.28692773841077723,COMPLETE
61,61,251.2952464,2024-07-01 12:09:04.828130,2024-07-01 12:22:49.244162,0 days 00:13:44.416032,tanh,50.0,0.000620972141373467,0.99,0.9345570536675197,,0.04699046089662912,linear,0.5,6,200.0,1.0,64.0,True,True,False,0.0002752322926381474,69.0,True,True,0.3124569785472162,COMPLETE
62,62,4.2,2024-07-01 12:14:01.714651,2024-07-01 12:35:21.979266,0 days 00:21:20.264615,relu,50.0,0.00016905414374198777,0.98,0.9745673134843423,,0.025721017763306868,constant,0.3,8,5.0,2.0,256.0,False,False,True,0.08289046459708735,10.0,True,False,0.4325631443845581,COMPLETE
63,63,98.46759260000002,2024-07-01 12:20:19.805319,2024-07-01 12:35:17.970260,0 days 00:14:58.164941,relu,100.0,0.0004307839015208684,0.98,0.9398310910860639,,0.005649052386517908,linear,0.9,8,50.0,2.0,256.0,False,False,True,0.0090090382236345,19.0,True,False,0.8227534659718436,COMPLETE
64,64,264.9525458,2024-07-01 12:22:49.286348,2024-07-01 12:35:55.092817,0 days 00:13:05.806469,elu,100.0,0.012667882589239194,0.98,0.9963321097560889,,0.0007523701697893417,constant,0.9,8,200.0,2.0,8.0,False,False,True,0.007353678493540531,8.0,True,False,0.20911431114074958,COMPLETE
65,65,7.3,2024-07-01 12:35:18.018740,2024-07-01 12:50:29.528048,0 days 00:15:11.509308,elu,100.0,0.0005000173029743038,0.98,0.9682914602820283,,0.011002309018492704,constant,1.0,8,10.0,1.0,8.0,False,False,True,0.012102642575058454,2.0,True,False,0.324284097599957,COMPLETE
66,66,79.2603356,2024-07-01 12:35:22.014948,2024-07-01 12:51:17.381574,0 days 00:15:55.366626,tanh,50.0,0.09322340096547643,0.95,0.9570639096939365,,0.00013955841153440046,constant,0.5,6,20.0,1.0,64.0,False,False,False,0.0025372143117197497,60.0,False,True,0.38523252685741344,COMPLETE
67,67,7.810612399999999,2024-07-01 12:35:55.152154,2024-07-01 12:53:06.239995,0 days 00:17:11.087841,tanh,50.0,0.00014832618400765116,0.98,0.9542566564576663,,0.0004531870448529626,linear,0.5,6,10.0,1.0,64.0,False,False,False,4.290411404594764e-05,62.0,True,True,0.5270736891827511,COMPLETE
68,68,267.64198799999997,2024-07-01 12:50:29.573097,2024-07-01 13:07:07.045226,0 days 00:16:37.472129,tanh,50.0,0.0761199050186879,0.95,0.9594781427161853,,0.0002189352071445993,linear,0.5,6,20.0,2.0,64.0,False,False,False,0.00036363176976158553,64.0,True,True,0.4649957922173102,COMPLETE
69,69,59.7721844,2024-07-01 12:51:17.427923,2024-07-01 13:06:04.958731,0 days 00:14:47.530808,tanh,50.0,0.03669557759045149,0.95,0.9692355960569252,,0.006979320959225843,linear,0.5,6,20.0,1.0,8.0,False,False,True,0.0008273131827919231,84.0,True,True,0.3898005676044496,COMPLETE
70,70,270.384906,2024-07-01 12:53:06.290362,2024-07-01 13:09:08.220381,0 days 00:16:01.930019,relu,100.0,0.0016053059753394355,0.98,0.951257919692022,,0.06843351491376067,constant,0.9,8,200.0,2.0,256.0,False,False,True,0.01528260639621332,8.0,True,True,0.31702684511299783,COMPLETE
71,71,262.3369904,2024-07-01 13:06:05.010665,2024-07-01 13:22:34.010050,0 days 00:16:28.999385,leaky_relu,10.0,0.03796820079824755,1.0,0.9981591050586707,,0.11313377429760253,linear,2.0,8,100.0,3.0,512.0,False,True,True,0.007336899980452528,67.0,True,False,0.1298305305153942,COMPLETE
72,72,215.4883412,2024-07-01 13:07:07.102501,2024-07-01 13:22:43.225632,0 days 00:15:36.123131,tanh,50.0,0.011704725364305248,0.98,0.9682204432023184,,0.003236356257404639,linear,0.5,6,200.0,1.0,256.0,False,False,False,0.024713303559320877,86.0,True,True,0.40027234884600693,COMPLETE
73,73,259.12218140000004,2024-07-01 13:09:08.267937,2024-07-01 13:22:49.276633,0 days 00:13:41.008696,tanh,50.0,0.0009183261845399523,0.95,0.9922574600211205,,0.0735929825540809,constant,0.9,8,100.0,1.0,128.0,False,True,False,0.0325515476961988,8.0,True,False,0.08177373619444506,COMPLETE
74,74,270.384906,2024-07-01 13:22:34.069731,2024-07-01 13:36:27.810885,0 days 00:13:53.741154,tanh,100.0,0.00041729754766053645,0.98,0.9589702367814625,,0.0011841208009334987,constant,2.0,6,20.0,1.0,256.0,False,False,False,0.0003283356641418114,67.0,True,True,0.6611748019100854,COMPLETE
